X1,NETID,RefType,Date,Time,Text,DYear
52,X5eU49bh,Public Personal,9/28/2013 11:21,11.35,"My goal in dental school is to come out as fully competent dentist. I will try to obtain attributes that would allow me not only to understand the science and procedures in dentistry but also allow me to develop social and personal skills. My mission is too understand dentistry in every single aspect so that when I am working with a patient I can make them fully aware of what is going on during a procedure. To obtain these attributes I will try to use every opportunity that NYU offers during the next four years, opportunities ranging from community outreach, club organizations and the great faculty that always are willing to help students. Ultimately during the next four years I want to come out as a well rounded dentist.",D1F
53,X5FRFc5a,Ethic Reflection,9/28/2013 11:21,11.35,"A major part of being a professional involves upholding certain ethical and moral obligations. I feel that as a dentist, I will constantly have my personal opinions clash with what is generally accepted by the general public. To avoid any subjective actions, I wish to follow a moral code in order make the best decision possible. This includes learning the certain ethics involved in treating patients as I want to be as fair as I can as my decision-making. By following ethical procedures, I will be able to provide moral propositions and a practical means of determining a course of action when deciding whether something is right or wrong.",D1F
54,X5FRFc5a,Public Self Reflection,9/28/2013 11:21,11.35,"In order to be professional, I feel I have to be qualified and capable of carrying out the duties entrusted to me.  There will be certain standards that are expected of me as I am trained to have the necessary skills to carry out my designated role. As a dental professional, I am responsible for the health of others, thus I must uphold certain ethical and moral obligations. I also must be competent and proficient in treating my patients since as a professional dentist, I will be entrusted to have the knowledge and expertise necessary to provide the best oral health care for everyone.",D1F
55,X5FRFc5a,Public Personal,9/28/2013 11:21,11.35,"As an aspiring dentist, it is my mission to constantly improve myself in dental school, whether in clinic or in studies, in order to be able to provide the best care for my future patients. I strive to be an independent, diligent, patient, and reliable dentist. I will never forget that I am a medical professional who is entrusted with the skill and responsibility to provide the best dental care for the greater community, thus I will be conscious of all of my actions as I want to uphold the integrity of being a provider of oral health care as a dentist. I will always be mindful, respectful and kind to others, whether it be my peers, mentors, faculty, or patients as I want to create a pleasant environment for everyone to be in. I am always open to advice or constructive criticism as I entered dental school with the mindset of tackling all my weakness and becoming a better person and professional dentist.",D1F
56,XAERJO+G,Ethic Reflection,10-02-13 14:39,14.65,"Being ethical has a lot to do with honesty, but also in stretching yourself to being the best that you can be.",D1F
57,XAERJO+G,Private Personal,10-02-13 14:37,14.61666667,I want to find a residency program that both excites and suits me.,D1F
58,XAERJO+G,Private Self Reflection,10-02-13 14:38,14.63333333,Being a professional to me means conducting oneself to a certain standard at all times. You are in a highly scrutinized field and I intend to live up to the expectation.,D1F
59,XAERJO+G,Public Self Reflection,10-02-13 14:37,14.61666667,Being a professional entails a high standard of academic integrity and communicating to others in a concise and respectful manner at all times.,D1F
60,XAERJO+G,Professional Progress,10-02-13 14:39,14.65,"Thus far, we are still undertaking the professionalism and ethics course, but I feel that we are learning a lot.",D1F
61,XAERJO+G,Public Personal,10-02-13 14:37,14.61666667,"My four years will be dedicated to practicing and building the skills necessary to become a proficient and competent dentist. I will work to become a well-rounded professional, eager and capable of assisting others in need.",D1F
62,Xf4neUF1,Public Self Reflection,9/28/2013 11:21,11.35,Stepping into the role of a professional will require me to constantly be looking for ways to improve my knowledge and skills. It will mean learning a whole new language for dealing with other health care professionals and understanding the relationship between doctors and patients. But most importantly it's a title that requires me to live up to a higher standard both in and out of the clinic.,D1F
63,Xf4neUF1,Public Personal,9/28/2013 11:21,11.35,"At my completion of dental school I plan to be wholly confident in the dental skills I have acquired and have a solid understanding of the science backing those skills. I will be able to build positive successful relationships based on respect with my patients, colleagues, and team members. That I will have a plan in place to continue my dental education after graduation, and have a strong knowledge base about joining and starting a dental practice. I will have outreach incorporated into my future practice, and have a clear ethical code by which my staff and I abide.",D1F
1,QG9tNBwe,Public Self Reflection,9/28/2013 11:21,11.35,"I hope to develop into a competent professional throughout my experiences at the dental school. A professional is not merely one who knows the procedures and tools of his trades, a professional must also act his part and be able to communicate his duties to his patients. By observing the interactions and relationships between the dentists and their patients in the clinic, I hope to be able to observe and mirror the relationships I see. By attending research conferences, I hope to observe and learn the ways that professionals present their work to their communities. Community outreach further develops one into a professional because one is responsible to representing his entire field and line of work.",D1F
2,QG9tNBwe,Public Personal,9/28/2013 11:21,11.35,"As an aspiring dentist, I would like to ensure that I am professional and competent at performing dental procedures in a timely and nearly flawless manner. I would like to maintain a clear path of communication with patients and attempt to destroy the stigma of a dental visit being a scary, painful and ruthless experience. I would like to serve my community by volunteering my services and encouraging people to seek dental care not only during urgent situations but making it a routine part of life as a preventative measure. 
	As members of the same field, interactions between professionals will be essential and vital to our success in the field.  One of the most important relationships in my future will be between myself and my future patients. I would like to ensure that they will be fully comfortable with me performing dental procedures. Over the next four years, I will observe many different patient-doctor interactions and learn from them the best ways to ease the fear of patients and educate about the procedures being performing.",D1F
3,QGe9TiW6,Private Personal,9/28/2013 11:21,11.35,"Going forward in dental school I aim to be able to deliver comprehensive dental care to a variety of communities and improve myself professionally as well as clinically. I will strive to be engaged in the school student body as well the city around us and utilize the peer and mentor resources available to augment my abilities as a student and a future dentist. In the future I hope to be able to practice as a pediatric dentist, being able to provide preventative and therapeutic care for the youth as well as instill healthy dental practices in their lives as they develop into adults.",D1F
4,QGe9TiW6,Private Self Reflection,9/28/2013 11:21,11.35,"I expect that my experiences through four years of school will guide me in becoming a dental professional. Things such as self assessment and peer assessment will allow me to see points of improvement and how to gain the empathy, ethics, and skills needed. Utilizing peer support, peer mentors, and faculty advisors will give me a similar such perspective on how to improve. I expect that simply working in the pre-clinical and clinical settings with my GPD group will allow me to gain the necessary professional competence. Going through experiences with actual patients will make me be able to realize how I've improved or gained professional skills. Those skills can again be reviewed by coworkers and peers that are giving me feedback on it. Technically, exams and evaluations will provide the actual feedback on my professional performance.",D1F
5,QGe9TiW6,Public Self Reflection,9/28/2013 11:21,11.35,"I expect that my experiences through four years of school will guide me in becoming a dental professional. Things such as self assessment and peer assessment will allow me to see points of improvement and how to gain the empathy, ethics, and skills needed. Utilizing peer support, peer mentors, and faculty advisors will give me a similar such perspective on how to improve. I expect that simply working in the pre-clinical and clinical settings with my GPD group will allow me to gain the necessary professional competence. Going through experiences with actual patients will make me be able to realize how I've improved or gained professional skills. Those skills can again be reviewed by coworkers and peers that are giving me feedback on it. Technically, exams and evaluations will provide the actual feedback on my professional performance.",D1F
6,QGe9TiW6,Public Personal,9/28/2013 11:21,11.35,"Going forward in dental school I aim to be able to deliver the highest quality comprehensive dental care in order to provide for the dental needs of society. I would like to improve myself professionally as well as clinically and will strive to be engaged in the school student body as well the city around us. I will utilize the peer and mentor resources available to augment my abilities as a student and a future dentist. I eventually hope to own my own practice in upstate New York, one that my patients will feel comfortable in and trust me in improving their oral and overall health.",D1F
7,QQQSr+E1,Ethic Reflection,9/28/2013 11:21,11.35,"Following our ethics course with Dr. More, I believe that ethics and ethical decisions are very important not only in a classroom setting, but also in a clinical setting and most importantly, in my dental practice once I graduate. I believe in honesty and following the rules. Although students are often inclined to take no action when witnessing unethical actions, I hope to be able to step forward and confront the student personally. Most importantly, I hope to be able to follow all rules while here at NYUCD and not make unethical decisions in the classroom and towards my patients. I believe providing the best possible health care is important and I hope to make only ethical and sound decisions when it involves my patients and peers.",D1F
8,QQQSr+E1,Private Personal,9/28/2013 11:21,11.35,"After graduating from dental school, I would like to be completely knowledgeable in the field of dentistry and be able to provide my patients with the best possible oral health care. I would like to be sufficiently competent and confident with all aspects of dentistry so that I am able to fully gain the trust and respect of my patients and colleagues. I hope to be a well-rounded individual that is not only a hard worker in the classroom setting, but also a compassionate and caring health care provider for my patients. I would like to participate in clubs and outreach programs. Last, I hope to be able to build meaningful relationships with not only my patients, but also my classmates and faculty here at NYUCD.",D1F
9,QQQSr+E1,Private Self Reflection,9/28/2013 11:21,11.35,"To me, becoming a professional and being professionally competent in the field of dentistry means being a well-rounded individual. Professionals have a thorough understanding and knowledge of dentistry and sufficient experience in the clinical setting to be able to treat patients. Professionals have learned the appropriate ways to treat patients, peers, and colleagues and do their best to provide the best possible oral health care to others. They are well-educated and have performed well in not only a classroom setting, but also in their pre-clinics and clinics. Professionally competent individuals are honest, ethical, and hard-workers. Most importantly, becoming a professional in the field of dentistry means putting my patients first. I hope to be able to accomplish these goals after graduating NYUCD and becoming a professional.",D1F
10,QQQSr+E1,Public Self Reflection,9/28/2013 11:21,11.35,"To me, becoming a professional and being professionally competent in the field of dentistry means being a well-rounded individual. Professionals have a thorough understanding and knowledge of dentistry and sufficient experience in the clinical setting to be able to treat patients. Professionals have learned the appropriate ways to treat patients, peers, and colleagues and do their best to provide the best possible oral health care to others. They are well-educated and have performed well in not only a classroom setting, but also in their pre-clinics and clinics. Professionally competent individuals are honest, ethical, and hard-workers. Most importantly, becoming a professional in the field of dentistry means putting my patients first. I hope to be able to accomplish these goals after graduating NYUCD and becoming a professional.",D1F
11,QQQSr+E1,Professional Progress,9/28/2013 11:21,11.35,"During my four years at NYUCD, I hope to progress to become not only a hard working student, but also a compassionate health care provider. Although the first two years are supposed to be academically very challenging, I hope this will help me become a hard worker. I hope the group practices and settings will allow me to become more confident in voicing my opinions and working with others. In the clinical setting, I hope to learn the skills of practicing on patients and interacting with patients. I hope to become extremely competent in all the dental procedures and treating patients. Most importantly, I hope to become a well-rounded individual that is a professional in the classroom and in a clinical setting.",D1F
12,QQQSr+E1,Public Personal,9/28/2013 11:21,11.35,"After graduating from dental school, I would like to be completely knowledgeable in the field of dentistry and be able to provide my patients with the best possible oral health care. I would like to be sufficiently competent and confident with all aspects of dentistry so that I am able to fully gain the trust and respect of my patients and colleagues. I hope to be a well-rounded individual that is not only a hard worker in the classroom setting, but also a compassionate and caring health care provider for my patients. I would like to participate in clubs and outreach programs. Last, I hope to be able to build meaningful relationships with not only my patients, but also my classmates and faculty here at NYUCD.",D1F
13,QRrjDz+o,Ethic Reflection,9/28/2013 11:21,11.35,"Being a competent dental professional entails many serious responsibilities and moral standards, and I am ready to take on those responsibilities. As I continue my dental training over the next four years I will learn about ethics in the profession of dentistry. I am confident that I have good judgement and moral character. When I am faced with ethical decisions in my career and personal life I expect to make the most responsible and ethically correct decisions and never compromise the well-being of my patients and family.",D1F
14,QRrjDz+o,Private Personal,9/28/2013 11:21,11.35,One of my long term goals is to get involved with forensic dentistry or dental genetics. I also want to start my own Family and Cosmetic Dentistry practice. I know I will learn a great deal about how to manage my time and think quickly on the spot to make important decisions. I am extremely detail oriented but sometimes that is not always a positive thing because I am easily caught up in small details. I hope to improve this and achieve a balance.,D1F
15,QRrjDz+o,Private Self Reflection,9/28/2013 11:21,11.35,"During my life I have acquired a good foundation for what I expect to be as a professional. I will acquire knowledge to become competent during all experiences in dental school, including faculty and peer interaction, classes, peer and self assessment, clinics, and patient interaction. I believe that all my experiences, especially the rough times and tough situations during the next 4 years will mold me into the professional I want to be and that I am expected to be by the dental profession.
      I believe I will be evaluated on my competencies through various sources. Besides faculty evaluation and competency testing, I will be evaluated by my peers and mentors on other levels besides technical skills. Ethics, behavior, communication will all be evaluated because all these things are what make a competent professional so they are all equally important qualities. Also, patient evaluations on my work provide a very different evaluation from a different perspective.",D1F
16,QRrjDz+o,Public Personal,9/28/2013 11:21,11.35,"I aim to become a confident and competent oral health practitioner and be able to build lasting relationships with colleagues, mentors, patients and their families. I would like to utilize the outreach resources available at NYUCD to make an effort to help underprivileged children and families improve their confidence and overall health. I am fortunate to be here and want to give back to my community and those in need of basic care, especially children. I have very high standards for myself and know that NYUCD also has high expectations for me to reach my full potential.",D1F
17,QRWkoYoa,Private Personal,11-08-13 10:30,10.5,NA,D1F
18,QRWkoYoa,Public Self Reflection,11-08-13 10:41,10.68333333,"Becoming a professional means striving to become a competent oral healthcare provider. A competent dentist needs to have great skills at hand but they should also encompass other various skills. Establishing a foundation in communication, ethics, integrity, respect is critical in developing into a great dentist that not only excels in his manual proficiency but also delivering the highest level of care in the best way possible.",D1F
19,QRWkoYoa,Public Personal,9/28/2013 11:21,11.35,"I have several goals as a dental student here at NYUCD. I want to develop better study habits and organization skills that are necessary to match the rigorous curriculum. My primary focus here is to learn the crafts of a great hands-on dentist. I wish to excel in a clinical and lab setting as well in academic courses. I want to create strong networks both inside and outside of the school that can hopefully last throughout and after dental school. After graduation, I wish to be a competent, passionate, friendly professional to provide and care for the oral health of New York City. I want to be a dentist that my patients can trust me in issues on not only oral health but other issues as well.",D1F
20,S4YOavA=,Private Personal,10-11-13 12:09,12.15,"I want to become the best oral health care professional possible. This is a difficult task but I feel NYUCD has the best education, clinics, outreach programs, and environment to provide me with the opportunity to obtain my goal. Part of becoming the best oral health care professional is the professional aspect of the job description. I believe the way I care about this health care field and the way I project myself to my peers and patients should be one and the same. I should exude professional competency through my skill, work, and demeanor.",D1F
21,S4YOavA=,Private Self Reflection,10-11-13 12:16,12.26666667,"I believe that I have a built a professional foundation from my professional and private experiences. Up to this point in time they have primarily been private experiences with professional experiences sprinkled in. Now at NYUCD, I have suddenly found myself full fledged professional from day one. I was taken back at first but I adapted well. I try to uphold myself to standard of a professional that I would trust and respect. I have a long way to go but this is a good start. My fellow peers and educators all hold themselves to the same standard and so it fosters a collaborative professional environment.",D1F
22,S4YOavA=,Public Self Reflection,9/28/2013 11:21,11.35,"In order to mature professionally, I will take advantage of all that NYUCD has to offer. I will build a basic foundation that will develop into advanced knowledge and an expert skillset of an oral health care professional though education and experience. This maturation will develop through coursework and exams, preclinical and clinics experiences, peer and patient interactions, peer and self-assessments, outreach programs, and leadership roles.",D1F
23,S4YOavA=,Public Personal,9/28/2013 11:21,11.35,"To be recognized by my patients, peers, and field as a trustworthy, competent oral health care professional and advocate through integrity, knowledge, and experience.",D1F
24,UNBNuyE4,Ethic Reflection,9/28/2013 11:21,11.35,"Being an ethical dentist is very important as there are numerous ways to be unethical.  In the dentistry field there are temptations to charge too much, say a patient needs a procedure when they dont, say a job is complete when we know its not, and many other scenarios.  Ethics has always been an important moral in my life.  In my humble opinion, the world is corrupt with unethical decisions from competent professionals.  These masters of their fields can go about completing half-finished and faulty work without anyone every questioning them.  To me, we will be making enough money to support our families while taking the time to treat each patient correctly.  There is no reason to perform halfhearted work in the sake of seeing more patients.  I hope to keep true to these morals, even when faced with a hard decision somewhere down the road.",D1F
25,UNBNuyE4,Private Personal,9/28/2013 11:21,11.35,"Besides what was said in the public reflection, it is extremely important for me to find a career which will allow me to be a provider for my future family.  I want nothing more than to be a loving father, right next to being a great dentist of course.  I know the path to this future requires hard work and passion, which I am ready to give, but I cant help but look forward to that day when I can go to work every day with a passion for my patients and to come home to a family that I can provide and be there for.",D1F
26,UNBNuyE4,Private Self Reflection,9/28/2013 11:21,11.35,"I know in order to become a professional, I will have to but in countless hours of work.  This is my passion I know it and Im ready to dedicate myself to dentistry through class, organizations, and outreach programs.  I had a rough college career and was able to get out of that rut and granted an opportunity to study at NYU dental.  I will not waste that opportunity and will dedicate myself to becoming the professional I know I can be.",D1F
27,UNBNuyE4,Public Self Reflection,9/28/2013 11:21,11.35,"The goal to becoming a competent professional will start by dedicating myself fully towards both classes and laboratory work.  Through these courses I will gain the knowledge to perform dental procedures; however, just because I pass a class does not equate to my professionalism.  In order to be a competent professional I will need to go outside of class to my professors, deans, advisors, and peers to help me perfect these procedures.  Later during my education, through clinical experience I will learn how to deal with patients and take my procedures to apply them in a professional way.  The goal will be to apply these procedures efficiently while keeping the patient calm and informed.  The ultimate goal will be to pull all of these aspects together in order to become the most competent, respective, knowledgeable, and successful dentist I can be.",D1F
28,UNBNuyE4,Professional Progress,9/28/2013 11:21,11.35,"The first day of classes was today!  Was really just introduced to the field, but I'm excited for tomorrow and ready to learn some more.  This attitude will probably last all of a week from what I have heard from D2s! But I'm ready for it.",D1F
29,UNBNuyE4,Public Personal,9/28/2013 11:21,11.35,"During my educational career at NYU dental, I strive to become a competent professional and a leader in my community.  When I leave this university I want to be confident in all my work.  This confidence with the mechanical aspect of dentistry, will allow me to focus on keeping patients calm and be supportive of their needs.  As a dentist it is essential to care for a patients entire well-being; thus, it is my goal to have a practice where the patient can feel comfortable and care about their oral health.  I also have been given a tremendous opportunity by NYU to study my passion and I feel it is my duty to take these practices not only to my office, but to the community that needs my help.  By becoming a competent dentist I wish not only to enhance my skills and knowledge, but to better the community as a whole.",D1F
