X1,NETID,RefType,Date,Time,Text,DYear
1,Q2a1zJef,Private Personal,9/28/2013 11:21,11.35,"For the next four years, I want to grow as an individual.  I want to become a professional.  I have been around the dental field for the past few years, working in a dental office as a dental assistant.  I want to transition from being a dental assistant to a dentist.  I hope once I finish my four years at NYU I will be a confident and ethical doctor.  I find it so important to establish trusting relationship with patients, and the first thing is to do everything in the best interest of the patient.",D1F
2,Q2a1zJef,Private Self Reflection,9/28/2013 11:21,11.35,"Becoming a professional I believe takes time.  You need to be exposed to situations where you need to interact with other professionals and learn from them.  I believe you never stop learning to become a professional, it is a lifelong process.",D1F
3,Q3KOrarY,Ethic Reflection,9/28/2013 11:21,11.35,"As a health care professional, it is my duty to be ethical in all my actions and interactions. In treating patients, I will learn about the community around me so that I can be culturally sensitive and empathetic. I will also stick to a code of ethics that I will hold myself to. These will include putting my patient's desires, and health and oral health above my own personal desires. I will always provide my patients with all their options so that they may be able to make the best decision for their oral health based on their limitations and their understanding. I will always document my procedures and any important events that occur during my patient's visit, so that I can legally protect myself and themselves, and so that the work is documented for future review.",D1F
4,Q3KOrarY,Private Personal,9/28/2013 11:21,11.35,"As a dental student, I will strive to learn about various oral health diseases and their symptoms, as well as different methods to improve oral hygiene. I will also learn the processes behind these diseases, and how to treat them. In the clinic, I will learn about the characteristics of each teeth, how to restore them via crowns, fillings, or root canals, how to remove caries, and how to create models and impressions for studying a patient's mouth or for preparing crowns or retainers. I will also learn how to interact with patients in terms of explaining procedures to them in words they can understand, in a manner that is respectful, and in a empathetic and ethical way (putting the patient's health and wants above my own personal desires). Finally, I hope to learn from my colleagues and practice communicating and working together with them.",D1F
5,Q3KOrarY,Private Self Reflection,9/28/2013 11:21,11.35,"Personally, as a professional I hope that I can possibly specialize in an area such as orthodontics, pediatrics, periodontics, or endodontics. However I will not limit myself to these specialties and I will explore other areas of specialty. I will also be satisfied with being a general dentist as well. Ultimately though, it depends on what I find I enjoy the most. I would also like to open my own clinic or at least have a clinic with another associate, especially because of the ease of accessibility to another dentist's opinion. Finally, I will strive to treat all my patients with respect, and all my colleagues with gratification and respect.",D1F
6,Q3KOrarY,Public Self Reflection,9/28/2013 11:21,11.35,"In becoming a health professional, I hope to provide my patients with the best care I can possibly give. That includes continuing my education by going to conventions and conferences to learn about the most up to date technologies for oral hygiene. I will also constantly challenge myself to better my work, by self-assessing myself often and checking on past work to see if anything should be redone. As a professional, I will strive for clear and concise communication with the patient and with my colleagues. I will also attempt to ensure that all my patients understand the importance of oral hygiene to overall health and the various ways they can take care of their teeth and health.",D1F
7,Q3KOrarY,Professional Progress,9/28/2013 11:21,11.35,"In my journey towards being a professional, I have learned how to interact with my peers and collaborate on work together. I have also learned how to study and help others when it comes to didactic and clinical work. I have recognized the importance of clear communication with peers to ensure understanding. I have also learned the importance of keeping the patient informed about their treatment. As I continue, I will learn how to speak to my patients in a professional and respectable manner. I will also learn how to communicate with my colleagues in a respectable and professional manner, especially over disagreements.",D1F
8,Q3KOrarY,Public Personal,9/28/2013 11:21,11.35,"As a dental student, I will strive to learn how to best serve my patients, the community around me, and various communities around the country and the world. Specifically, I will become knowledgeable on the causes and symptoms of dental diseases as well as full body diseases, especially those that can become evident in the oral cavity. I will learn to treat patients both in the short-term and long-term capacity. I will also strive to treat all my patients with respect, sympathy, and ethically. I will always put the patient's health and desires above any personal gain, and I will be sure to refer my patient's to other doctors or dentists if I do not feel able to complete a procedure.",D1F
9,Q3wmSU0o,Ethic Reflection,9/28/2013 11:21,11.35,"I think that ethical problems are the most important aspect in practicing dentistry. Throughout my studies at NYUCD, I will never allow myself to cheat, help in cheating or condoning such behaviors, because I think that it is detrimental to the society and the profession.",D1F
10,Q3wmSU0o,Private Personal,9/28/2013 11:21,11.35,"I would like to pass most, if not all, exams without failing. I will manage my time well so that I will have a plenty of time to rest on weekends. I want to enjoy NYC and plan to have some life by swimming and attending church on weekends, and traveling and meeting old and new friends on vacation.",D1F
11,Q3wmSU0o,Private Self Reflection,9/28/2013 11:21,11.35,"First of all, I will absorb necessary knowledge in order to pass my classes and the board exams so that I know what I will be doing in the clinics. In clinic, I will learn from my GPD and instructors about how to behave as a dentist and uphold professional standards.",D1F
12,Q3wmSU0o,Public Self Reflection,9/28/2013 11:21,11.35,"I think that becoming a professional is my life-long goal. Maintaining high ethical and moral standards has been one of the most important philosophical aspects of my life. Becoming a dental professional will allow me to apply my philosophy to be able to help treat patients and contribute to society. I will ask as many questions as possible that I have throughout my educational career at NYUCD to professors and peers, and utilize the school resources for progress in my dental career.",D1F
13,Q3wmSU0o,Professional Progress,9/28/2013 11:21,11.35,"The orientation was long, but it already taught me many things about dental school. Interacting with orientation leaders allowed me to get a sense of how much studying will be done in the first two years. Also, the school made it clear how to use the resources and what the administrators and professors expect from me. I look forward to starting my classes tomorrow.",D1F
14,Q3wmSU0o,Public Personal,9/28/2013 11:21,11.35,"I would like to successfully complete my DDS program in 4 years without remediation and move onto a GPR residency in the NYC region. My goal is to make professional and personal contacts within NYUCD and in NYC. I would like to spend time studying the basic sciences and thoroughly learn general dentistry skills in the clinic, at the same time enjoying the materials. In doing so, I intend to get involved in many outreach trips and school-related clubs, in particular the Korean Student organization and ADEA. I would like to become close friends with people from my group and other classmates whom I will get to meet. In my D3 and D4 years, I am interested in participating elective and Honors programs because even if I become a GP, I want to be knowledgeable about systemic oral disease detections. I would like to be a helpful member of the NYUCD community and reach our professional goals as a whole.",D1F
15,QRWhtutU,Public Self Reflection,9/28/2013 11:21,11.35,"Dentistry is one of the few professions that requires not only the high practical prowess but also moral and ethical standards. There are several factors that make a dentist a good professional but I believe one of the most important things for a professional is to be independent and proficient in their job. In other words, professionals should be consistent and punctual. In addition, it is important to follow the rules and regulation to prevent reckless and nefarious malpractices. However, this does not mean that one should be stagnant and passive in their profession. Rather, I believe it is important for professional to actively seek out for improvements and advancements. This can be achieved through working, discussing and researching issues with different professionals in various different fields in the profession. Moreover, it is important for professionals to have appropriate moral and ethical standards. I believe these are some of the factors that are crucial in becoming a good professional.",D1F
16,QRWhtutU,Public Personal,9/28/2013 11:21,11.35,"Ever since I realized that dentistry is one of the few professions that seamlessly blend both artistry and science, I was fascinated by it. It is, thus natural, that I have vast interest in becoming an orthodontist. However, I would like to be exposed to a various different dental specialties not only through school curriculum but also through community outreach and volunteer service. As a dental student, I would like to graduate dental school in good standing with proficiency in general dentistry. As a health care professional, I would like to learn not only the technical skills but also the interpersonal skills to have fulfilling relationships with various different patients. I realize this skill would require me to uphold my ethical principles as well as the rules and regulation at all times. Moreover, I hope that I would be more open-minded and bold in making decisions. In addition, I would like to have a good lifelong relationship with my peers in both private and professional environment.",D1F
17,QRWhtutX,Ethic Reflection,9/28/2013 11:21,11.35,"I want to always be putting my patients first above all us when I progress through dental school and eventually in my professional career. I believe that as a healthcare professional, we have a duty to provide our patients with the most effective treatment and when we know we are not the right person for our patient to not hesitate and relay our patient to the right person. 

While in dental school I want to always put forth an honest effort in my work and not take any shortcuts because I want to make sure I really understand what is being taught as my future patients deserve that kind of honest effort from their dentist. Also I want to contribute to an honest learning environment and reach out to any peers that I may see struggling.",D1F
18,QRWhtutX,Private Personal,9/28/2013 11:21,11.35,I hope to work not just hard but smart and produce the results necessary to have multiple options ready when I graduate. Currently I am really interested in the field of pediatrics so I want to put myself in the position to learn as much as I can about the field and make sure when I do make a decision that it is an informed one.,D1F
19,QRWhtutX,Private Self Reflection,9/28/2013 11:21,11.35,"Aside from the points mentioned in the public self reflection portion, I want to become more open minded and be better at taking criticism as that will be important when dealing with patients as well as my future dental team. So far into the year I have been good about being punctual but I want to persist in having good punctuality as it was a weakness of mine in the past.",D1F
20,QRWhtutX,Public Self Reflection,9/28/2013 11:21,11.35,"I believe in order to become a professional in the field of dentistry, you must go beyond knowing just the craft of dentistry. It also means how you present yourself and how you treat the people you are working with. For instance punctuality and respect are two important aspects that patients look for in a dentist aside from his/her technical abilities. A dentist that is unorganized or difficult to make appointments with is hard for the patient to trust in putting their oral health in. Also even though the dentist is the head of his/her practice, it takes a cohesive and supportive team of individuals to treat the dental patient properly. Thus, a dentist that does not present him/herself to the dental team in a professional manner will never gain their trust.",D1F
21,QRWhtutX,Professional Progress,9/28/2013 11:21,11.35,At this point I am not entirely certain where I want to practice dentistry. I do know that if I feel that I am not ready once I graduate from dental school I will immediately look to do some residency to get myself to the level of competency I am comfortable to practice solo. I do want to eventually have my own dental practice and after some time try to expand.,D1F
22,QRWhtutX,Public Personal,9/28/2013 11:21,11.35,"I hope to become competent enough that when I graduate my friends will fully trust me to perform dentistry on them if need be. I hope to at least maintain the passion I had for this field when I walked to my first class this year and hopefully expand that passion when I graduate. I want to work  hard and to always be humble of the fact that I should never be satisfied with my level of competence in dentistry. As long as I keep learning I know I will be more competent than yesterday but not as competent as I can be tomorrow. Areas that I need to work on is to be less stubborn and more open minded, and I need to be organized with my clinics and lab from the get go to not get messy habits.",D1F
23,Rgwz95M=,Ethic Reflection,9/28/2013 11:21,11.35,"I have always considered myself a very ethical person.  I strive to live my life a certain way, and to treat others as I would want to be treated.  My family dentist is a man who I feel is a very ethical person, who always does the right thing and puts the needs of his patients first.  While I have heard stories about other dentists refusing to see a certain type of patient, my family dentist always has an open door.  He believes that his job wasnt to make as much money as possible, but to service others and give back to his community.  As a future dentist this is how I want to run my practice.  I want to be known as the dentist who will see everyone, no matter what his or her situation may be.  I feel that to be a great dentist, you have to be a great person first and foremost.  You have to admit and correct your mistakes.  Above all, you have to truly care about your work and your patients.  You have to WANT to make a difference in someones life.",D1F
24,Rgwz95M=,Private Personal,9/28/2013 11:21,11.35,"My private statement is basically the same as my public statement.  I see how the dentists that I know live their lives, and I want that lifestyle.  I have never been the one to seek appraisal, but I want to be known as a great dentist, someone who listens to and actually cares about his patients.  I have no idea where I would like to practice, but I am leaning more towards going back home to Niagara-on-the-Lake.  I do however feel guilty about pursuing a career in dentistry, as my family back home owns a couple of vineyards, and there is always lots of work to do.  However, now my dad has to bear the brunt of the work by himself.  While I do know that he is proud of what Ive accomplished, I would like to go back home when I graduate and help my parents out as much, if not more, than they have helped me.  I am leaning towards working 3-4 days a week at my practice, and possible 2-3 days helping out on the farm.  I feel like that would be the ideal situation.",D1F
25,Rgwz95M=,Private Self Reflection,9/28/2013 11:21,11.35,There is nothing that I would want to add in my private self-reflection that would be different from my public reflection.,D1F
26,Rgwz95M=,Public Self Reflection,9/28/2013 11:21,11.35,"I believe that a professional should possess the knowledge, skills, personality and morals to make her/him successful.  I have always wanted to become a dentist and work in the health-care profession because I truly like helping people; especially making people smile and happy.  However, I have noticed that a lot of people I know would say to me,  you are going to make so much money,  but to be honest I do not care about money.  To me, dentistry would be the perfect lifestyle and not a job/work.  How can it be work if you get to do what you love and are interested in everyday?  I get to interact with my patients and be there for them, whether it be dental related or otherwise.  I want to be known as the ""people's dentist"", where everyone knows my name and knows that my door is open to everyone. While I know that I am a long ways away from becoming a dentist, I am enjoying the adventure, and counting down the days that I can finally be called a dentist.",D1F
27,Rgwz95M=,Professional Progress,9/28/2013 11:21,11.35,"Being only 3 weeks into dental school I have not had much professional progress to date.  However, I feel that with the start of the pre-clinical labs that I am very slowly becoming a dentist.  Some of our classes have made me realize how we should be interacting with not only our future patients, but with one another and our colleagues.",D1F
28,Rgwz95M=,Public Personal,9/28/2013 11:21,11.35,"To me, teeth are much more than just small, calcified structures whose main purpose are the mechanical breakdown of food.  While they can cause considerable pain and discomfort, teeth can also bring joy and happiness.  I have always believed that dentists treat much more than just patients teeth.  A dentist has the capability to improve a persons life through their smile.  A dentist can improve how a person views themselves and possibly how others view them.  My desire has always been to become a dentist so that I can make a difference in my patients lives, no matter how big or small.  As a future health care professional, I believe that everyone should be entitled to dental care.  I am looking forward to giving back to communities, both locally and abroad, through the various outreach programs that NYUCD offers.  However, to be able to successfully and efficiently provide dental care, I must first gain the knowledge and skills that are required to provide patients with the best possible treatment.  I am excited to start this journey, and am anxious for the day when I can help change someones life.",D1F
29,RJvUP4aC,Private Personal,9/28/2013 11:21,11.35,"Throughout these next four years, I look forward to being molded into a competent and professional healthcare provider. I hope to build new professional relationships with my fellow colleagues and faculty. My time at NYUCD is an opportunity to best prepare myself for the demands of this field and the needs of my patients.",D1F
30,RJvUP4aC,Public Personal,9/28/2013 11:21,11.35,"Throughout these next four years, I look forward to being molded into a competent and professional healthcare provider. I hope to build new professional relationships with my fellow colleagues and faculty. My time at NYUCD is an opportunity to best prepare myself for the demands of this field and the needs of my patients.",D1F
31,UMXIJMd9,Private Personal,9/28/2013 11:21,11.35,"In my public statement I said I want to fix people's faces. I know that sounds kind of vague, and I haven't found a better way to express that just yet, but what I mean is to fix whatever facial deformities or defects that are present. My pre-dental society in undergrad would have dental health professionals speak every week and I remember one in particular where he should photos of people that had to wear facial prosthetics to cover what were essentially parts of their face or jaw missing. At the time I thought the very fact a prosthodontist could make something and give it to the patient to wear was amazing. But what I really want to do is go one step beyond that and make wearing the prosthetic unnecessary. Facial reconstruction is I think the coolest thing. From what I know I think leans heavily toward OMS and bigger hospital surgeries which I rather prefer than private practice. When we talk about improving quality of life, I believe there is no greater way to increase that than down this path.",D1F
32,UMXIJMd9,Public Self Reflection,9/28/2013 11:21,11.35,"In undergrad, I was a Human Biology major, but I also minored in Philosophy. One particular article sticks out in my mind whenever I think of professionalism and what it means. The article talked about ""civic professionalism"" and how there is an inherent contract, or trust, between the public and the professional. And moreover, we as professionals should give back to the community for without the community providing patients how would we have learned our craft. I think that as I progress throughout dental school this will become more relevant and I know whatever opportunity I have to give back or do a community outreach I will try my best to make it happen. What's the point of having these skills if we don't try to use them to promote the greatest degree of quality life we can.",D1F
33,UMXIJMd9,Public Personal,9/28/2013 11:21,11.35,"My journey to dental school has left me with a number of experiences that have shaped not only the type of dentist I want to be, but also how I view the relationship between one's oral health and their quality of life. I've worked with dental professionals from around the United States, Mexico, and Australia and have a strong sense of what I want to get out of dentistry -- I simply want to be able to fix people's faces. To me,  a person's face is their most important feature giving them the self-confidence to go out and interact with the world. Now what path this aim of mine takes me down from here on out I don't know, but what I do know is that throughout all the pitfalls I've overcome I will not lose sight of my goal. I feel privileged to be apart of this great profession.",D1F
34,USg0zn4j,Public Personal,9/28/2013 11:21,11.35,"Dentistry is a creative and independent field. It is a very flexible profession that allows me to pursue other dental related interests outside of working in a group or office. Some of my future goals in dentistry include volunteering for programs that help underserved communities in the U.S and poverty-stricken areas throughout the world where dental care is not readily available. New York University College of Dentistry is in one of the best schools to facilitate my goals because it has many programs that serve the underserved communities. Furthermore, NYUCD has a diverse patient population, which allows me to interact with people of all different socioeconomic backgrounds. As a dentist, I wish gradually become a cherished counselor and confidant. I realized the personal contact integrated within dentistry permits a unique interaction with people of diverse ages, cultures, and backgrounds.",D1F
35,USOSSVQW,Private Personal,9/28/2013 11:21,11.35,"I know that there isn't much room to procrastinate in dental school, so I am going to try to study and go over the notes every day this semester. I've heard that pulling all-nighters is not a good idea, so I should remind myself not to become lazy. I want to develop a regular sleeping pattern so that I can go to classes and use my time wisely when I am awake. I am a little stressed about what I am going to face over the next four years, but I feel more responsibility in what I learn and do now. I think it's good to have a little bit of stress as I study and participate in labs, but I will try not to be too overwhelmed.",D1F
36,USOSSVQW,Public Personal,9/28/2013 11:21,11.35,"I chose to become a dentist even before I started my undergrad, and I am very happy to be here. I am finally at a stage where I get to learn the ""practical"" knowledge here at NYUCD, and I feel more responsible for understanding and applying the knowledge. All the information I receive in lectures and labs will be essential for my future practice, and I just want to keep up with the workload. I am interested in going into pediatric dentistry, so I will have to try really hard to get where I want to be. I love how our school has a very diverse student body, and I hope I can make a lot of friends. I am pretty excited to start a new phase in my life, and I just want to make the most out of it.",D1F
37,UT8VFDpf,Ethic Reflection,9/28/2013 11:21,11.35,"To become ethical, one must first be able to know what is right and what is wrong.  And then, after know what is right and what is wrong, one must understand the appropriate actions following the determination.  It takes knowledge, experience, and courage to become truly ethical, and I aspire to become a great dentist that could deliver this to my future patients.",D1F
