"Text","doc_id"
"ethic will base practice","1"
"deliver good possible care ethical time intend practice base practice","2"
"next four year want grow individual","3"
"want become professional","4"
"around dental field past year work dental office dental assistant","5"
"want transition dental assistant dentist","6"
"hope finish four year nyu will confident ethical doctor","7"
"find important establish trust relationship patient first thing everything good interest patient","8"
"become professional believe take time","9"
"need expose situation need interact professional learn","10"
"believe never stop learn become professional lifelong process","11"
"become professional believe take time","12"
"need expose situation need interact professional learn","13"
"believe never stop learn become professional lifelong process","14"
"begin dental career two year ago come long way far","15"
"gain many skill interpersonally socially importantly manual dexterity","16"
"look forward apply skill eager learn next two year nyucd","17"
"next four year want grow individual","18"
"want become professional","19"
"around dental field past year work dental office dental assistant","20"
"want transition dental assistant dentist","21"
"hope finish four year nyu will confident ethical doctor","22"
"find important establish trust relationship patient first thing everything good interest patient","23"
"health care professional duty ethical action interaction","24"
"treat patient will learn community around can culturally sensitive empathetic","25"
"will also stick code ethic will hold","26"
"will include putting patient desire health oral health personal desire","27"
"will always provide patient option may able make good decision oral health base limitation understand","28"
"will always document procedure important event occur patient visit can legally protect work document future review","29"
"will never discriminate will serve equally regardless ethnicity gender faith sexual orientation etc take consideration various culture belief patient sensitive understand","30"
"dental student will strive learn various oral health disease symptom good different method improve oral hygiene","31"
"will also learn process behind disease treat","32"
"clinic will learn characteristic tooth restore via crown filling root canal remove caries make complete partial denture create model impression study patient mouth prepare crown retainer","33"
"will also learn interact patient term explain procedure word can understand manner respectful empathetic ethical way putting patient health want personal desire","34"
"finally hope learn colleague practice communicate work together help return","35"
"believe environment everyone honest work together team end benefit work good patient treat","36"
"personally professional hope can possibly specialize area orthodontics pediatrics periodontics endodontics","37"
"however will limit specialty will explore area specialty","38"
"will also satisfy general dentist good","39"
"ultimately though depend find enjoy","40"
"also like open clinic less clinic another associate especially ease accessibility another dentist opinion","41"
"finally will strive treat patient respect colleague gratification respect","42"
"will try patient patient can difficult communicate patient may different ideology","43"
"will make sure aware various cultural belief sensitive time mindful make multitude identity","44"
"become health professional hope provide patient good care can possibly give","45"
"include continue education go convention conference learn date technology oral hygiene","46"
"will also constantly challenge good work selfassessing often check past work see anything redo","47"
"professional will strive clear concise communication patient colleague","48"
"will also attempt ensure patient understand importance oral hygiene overall health various way can take care tooth health","49"
"even patient difficulty practice want make sure give information knowledge can make autonomous decision dental health","50"
"3 year ive learn much oral cavity can reflect disease body oral cavity can affect change occur patient body","51"
"ive learn work another student dental assistant vice versa learn team effort","52"
"ive learn step process need create complete removable partial denture","53"
"ive learn prepare crown bridge good make temporary crown bridge","54"
"ive learn interact patient now clinic start understand communicate patient way show professionalism competence still student school","55"
"clinic ive able practice patient good give local anesthesia patient form nerve block infiltration comprehensive exam xray prophylaxis scale root plane restoration","56"
"still yet perform endodontics yet aim soon","57"
"dental student will strive learn good serve patient community around various community around country world","58"
"specifically will become knowledgeable cause symptom dental disease good full body disease especially can become evident oral cavity","59"
"will learn treat patient shortterm longterm capacity","60"
"will also strive treat patient respect sympathy ethically take account various cultural identity sensitive understand","61"
"will always put patient health desire personal gain will sure refer patient doctor dentist feel able complete procedure","62"
"will practice communication skill honest patient","63"
"will practice skill competent able serve other good","64"
"strive continue learn new method technique technology appropriate good able treat patient","65"
"believe practitioner attitude fundamentally influence patient view health decision make process","66"
"integrity personal standard goal aspiration important factor earn respect peer colleague patient general public","67"
"public expect health profession behave make decision utmost ethical standard","68"
"important realize ethical dilemma can solve five principle ethic value profession","69"
"ever since realize dentistry one profession seamlessly blend artistry science fascinate","70"
"thus natural vast interest become orthodontist","71"
"however like expose various different dental specialty school curriculum also community outreach volunteer service","72"
"dental student like graduate dental school good stand proficiency general dentistry","73"
"health care professional like learn technical skill also interpersonal skill fulfill relationship patient various different background","74"
"realize skill require uphold ethical principle good rule regulation time","75"
"moreover hope openminded bold make decision","76"
"addition like good lifelong relationship peer private professional environment","77"
"dentistry one profession require high practical prowess also moral ethical standard","78"
"several factor make dentist good professional believe one important thing professional independent proficient job","79"
"word professional consistent punctual","80"
"addition important follow rule regulation prevent reckless nefarious malpractice","81"
"however mean one stagnant passive profession","82"
"rather believe important professional actively seek improvement advancement","83"
"can achieve work discuss research issue different professional various different field profession","84"
"moreover important professional appropriate moral ethical standard","85"
"believe factor crucial become good professional","86"
"dentistry one profession require high practical prowess also moral ethical standard","87"
"several factor make dentist good professional believe one important thing professional independent proficient job","88"
"word professional consistent punctual","89"
"addition important follow rule regulation prevent reckless nefarious malpractice","90"
"however mean one stagnant passive profession","91"
"rather believe important professional actively seek improvement advancement","92"
"can achieve work discuss research issue different professional various different field profession","93"
"moreover important professional appropriate moral ethical standard","94"
"believe factor crucial become good professional","95"
"believe professional demonstrate competency proficiency vocation high ethical standard good personal quality compassion respect empathy","96"
"overall work hard get everything class take school clinic even graduate start work will able apply knowledge skill achieve school","97"
"ever since realize dentistry one profession seamlessly blend artistry science fascinate","98"
"thus natural vast interest become orthodontist","99"
"however like expose various different dental specialty school curriculum also community outreach volunteer service","100"
"dental student like graduate dental school good stand proficiency general dentistry","101"
"health care professional like learn technical skill also interpersonal skill fulfill relationship patient various different background","102"
"realize skill require uphold ethical principle good rule regulation time","103"
"moreover hope openminded bold make decision","104"
"addition like good lifelong relationship peer private professional environment","105"
"want always putting patient first us progress dental school eventually professional career","106"
"believe healthcare professional duty provide patient effective treatment know right person patient hesitate relay patient right person","107"
"dental school want always put forth honest effort work take shortcut want make sure really understand teach future patient deserve kind honest effort dentist","108"
"also want contribute honest learn environment reach peer may see struggle","109"
"hope work just hard smart produce result necessary multiple option ready graduate","110"
"currently really interest field pediatrics want put position learn much can field make sure make decision inform one","111"
"passion pediatrics grow partake inreach outreach event nyucd want also explore specialty can become wholesome dental knowledge ideal","112"
"really happy year citizen school fully integrate one main outreach club nyucd","113"
"also first dental screening gtp many schedule come","114"
"also track pursue passion pediatrics","115"
"aside point mention public self reflection portion want become open mind good take criticism will important deal patient good future dental team","116"
"far year good punctual want persist good punctuality weakness mine past","117"
"still feel can organize","118"
"work area still get really messy treatment do sometimes still forget supply need session","119"
"clinical treatment perform still feel comfortable endo crown treatment","120"
"believe order become professional field dentistry must go beyond know just craft dentistry","121"
"also mean present treat people work","122"
"instance punctuality respect two important aspect patient look dentist aside hisher technical ability","123"
"dentist unorganized difficult make appointment hard patient trust putting oral health","124"
"also even though dentist head hisher practice take cohesive supportive team individual treat dental patient properly","125"
"thus dentist present himherself dental team professional manner will never gain trust","126"
"one important thing really listen patient concern","127"
"do approach treatment session without open mind sometimes need adapt patient need","128"
"point entirely certain want practice dentistry","129"
"know feel ready graduate dental school will immediately look residency get level competency comfortable practice solo","130"
"want eventually dental practice time try expand","131"
"point think go career practice part time pediatric dentist also explore public health side profession","132"
"think large room grow especially find way target area access dental outreachesscreenings","133"
"hope become competent enough graduate friend peer instructor will fully trust perform dentistry need","134"
"hope less maintain passion field walk first class year hopefully expand passion graduate","135"
"want work hard always humble fact never satisfy level competence dentistry","136"
"long keep learn know will competent yesterday competent can tomorrow","137"
"area need work little stubborn open mind need organize clinic lab get go get messy habit","138"
"good want present professional manner patient representative school professional profession","139"
"feel right now 3 year still lack many clinical area","140"
"always consider ethical person","141"
"strive live life certain way treat other want treat","142"
"since time clinic notice fellow dental student like walk fine ethical line thing ethically comfortable","143"
"try worry student can work person kind dentist want","144"
"public personal statement","145"
"public self reflection become professional","146"
"spend approximately year dental clinic still do think dental professional","147"
"patient want give dr title really believe earn distinction yet","148"
"usually just tell call mikemichael","149"
"think will still way receive dr distinction","150"
"sure though","151"
"maybe due background bring just consider like everyone else exception actually doctor","152"
"around dental student feel like dental professional","153"
"parent brother girlfriend nondental friend always ask dental relate question feel like actually know talk make feel like dentist","154"
"far time clinic have tremendous learn experience good lot fun","155"
"finally get apply knowledge ive gain have have year good gain new knowledge tipstricks d various faculty","156"
"first start clinic nervous unsure able deal treat patient","157"
"now clinic approximately year feel comfortable competent ability","158"
"first majority treatment srps feel like know efficiently properly complete procedure","159"
"now find complete complex procedure become comfortable perform root canal postcores crown complete removable prosthesis","160"
"also find rely little little specialty faculty assess patient complex need consult necessary step confirm findingsresults","161"
"now clinic year feel like become dentist","162"
"great gain didactic knowledge know utilize perform procedure patient","163"
"first month clinic slow nervous unsure knowledge skill term treat patient","164"
"however exposure believe slowly become competent practitioner","165"
"find hand skill diagnose ability performance perform complex procedure significantly increase since start clinic","166"
"still certain aspect feel like need work take initial impression diagnostic stone model however feel like skill will develop practice attention detail may wrong certain procedure","167"
"excite continue growth development dental professional look forward final year graduation","168"
"today treat provide first hand care patient month","169"
"recently patient look eye say trust judgment ill think good","170"
"many appreciate hear however actually feel sense burden","171"
"burden make clinically sound decision decision patient expect will long term sustainable solution","172"
"end spectrum decision abide ethic principle value","173"
"patient confide medical health relate matter furthermore ask professional advice regard wellbeing","174"
"something take grant intend uphold great level confidentiality come patient care","175"
"healthcare professional will hold high standard eye public aspect patient care","176"
"day patient encounter learn good realm ethic professionalism","177"
"grow dentist influential definition dentistry","178"
"interaction comfort approach treatment define think dentistry still describe day","179"
"love talk school sport tv show ever ask open mouth","180"
"know set tooth name chart","181"
"look forward provide patient similar experience","182"
"look forward develop knowledge skill necessary promise patient good quality care","183"
"throughout next year envision mold competent healthcare provider","184"
"hope build professional relationship colleague faculty","185"
"time nyucd opportunity good prepare demand dentistry need patient","186"
"dentistry evolve field excite part will offer near come future","187"
"term professional throw around lot everyday conversation","188"
"may declare someone professional hockey player professional stone carver","189"
"word professional carry value sense high standard","190"
"expect professional expertise reassurance work role fulfill will high quality","191"
"hear word dental professional imagine someone look upon general public trust figure provide utmost quality care treatment","192"
"professional person receive structure education andor discipline pertain specifically profession","193"
"individual accept one prove hisher competence demand field","194"
"student nyucd like imagine approach definition professional progress tier dental school","195"
"excite important dynamic influence patient life serve vital component path healthy lifestyle","196"
"great privilege trust individual society look upon symbol wellbeing","197"
"term professional throw around lot everyday conversation","198"
"may declare someone professional hockey player professional stone carver","199"
"word professional carry value sense high standard","200"
"expect professional expertise reassurance work role fulfill will high quality","201"
"hear word dental professional imagine someone look upon general public trust figure provide utmost quality care treatment","202"
"professional person receive structure education andor discipline pertain specifically profession","203"
"individual accept one prove hisher competence demand field","204"
"student nyucd like imagine approach definition professional progress tier dental school","205"
"excite important dynamic influence patient life serve vital component path healthy lifestyle","206"
"great privilege trust individual society look upon symbol wellbeing","207"
"someone tell start formal dental education dental school change","208"
"change way communicate change way present change way view peer","209"
"look back summer dental school think back first patient interaction can undeniable admit indeed change","210"
"get good putting other shoe walk mile","211"
"become aware say say perceive patient around","212"
"develop professional relationship colleague faculty private practice mentor","213"
"plan remain malleable continue mold contribute change dental field process change","214"
"grow dentist influential definition dentistry","215"
"interaction comfort approach treatment define think dentistry still describe day","216"
"love talk school sport tv show ever ask open mouth","217"
"know set tooth name chart","218"
"look forward provide patient similar experience","219"
"look forward develop knowledge skill necessary provide patient good quality care","220"
"throughout next year envision mold competent healthcare provider","221"
"hope build professional relationship colleague faculty","222"
"time nyucd opportunity good prepare demand dentistry need patient","223"
"dentistry evolve field excite part will offer near come future","224"
"encounter many ethical situation think relate directly professionalism","225"
"act ethical mean always right just keep patient wellbeing center attention","226"
"tell act patientcentered focus must always examine every situation idea forefront","227"
"whether didactics clinical able frame everything ive learn context will affect patient help tremendously keep focus act professional ethical manner","228"
"year dental school pass ive learn mean become professional","229"
"since begin treat patient ive experience inherent trust must present dentist patient","230"
"look us guidance assurance can treat condition also answer question health wellbeing","231"
"believe dentist must act way honor profession respect patient","232"
"3 year almost do 4 year begin journey become dental professional almost come finish","233"
"clinic allow apply ive learn first 2 year various clinical experience","234"
"know still lot learn open mind heart know will able become good professional can","235"
"ethic define moral principle govern person ’ s group ’ s behavior","236"
"become dentist hold high standard ethic position power","237"
"people ’ s trust belief help take advantage situation","238"
"will dentist respect know excellent work do ethical criterion","239"
"believe four principle healthcare ethic autonomy beneficence nonmaleficence justice","240"
"strive always honest straightforward respect right patient","241"
"furthermore will communicate patient way enable empower make inform decision","242"
"will strive achieve high quality effectiveness dignity process product professional work","243"
"dentistry creative independent field","244"
"flexible profession allow pursue dental relate interest outside work group office","245"
"future goal dentistry include volunteer program help underserved community us povertystricken area throughout world dental care readily available","246"
"new york university college dentistry one good school facilitate goal many program serve underserved community","247"
"furthermore nyucd diverse patient population allow interact people different socioeconomic background","248"
"dentist wish gradually become cherish counselor confidant","249"
"realize personal contact integrate within dentistry permit unique interaction people diverse age culture background","250"
"become dentist give lot opportunity really want career","251"
"career will always able help people need service","252"
"due success preventive dentistry reduce oral incident can see lot elderly people keep tooth long realize importance regular dental care service","253"
"mean demand dental care will continue grow dentist need","254"
"career excite due fact every day get help people different background walk life","255"
"moreover career go opportunity one thing really love help other give back community","256"
"career will let teach good habit good health","257"
"will also let educate patient good general public achieve oral health prevent disease","258"
"become dentist give lot opportunity really want career","259"
"career will always able help people need service","260"
"due success preventive dentistry reduce oral incident can see lot elderly people keep tooth long realize importance regular dental care service","261"
"mean demand dental care will continue grow dentist need","262"
"career excite due fact every day get help people different background walk life","263"
"moreover career go opportunity one thing really love help other give back community","264"
"career will let teach good habit good health","265"
"will also let educate patient good general public achieve oral health prevent disease","266"
"shortterm goal graduate new york university college dentistry year residency hospital","267"
"long run intend work group practice spend time global outreach","268"
"professional development goal reside soul since come contact dentistry first time","269"
"dental student learn dentistry play crucial role healthcare field","270"
"learn every part body affect body whole","271"
"capability communicate cooperate team member surmount obstacle hardworking perseverance help provide patient good care can give","272"
"vow continually learn different innovative technique provide evidence base dentistry care patient","273"
"dentistry creative independent field","274"
"flexible profession allow pursue dental relate interest outside work group office","275"
"future goal dentistry include volunteer program help underserved community us povertystricken area throughout world dental care readily available","276"
"new york university college dentistry one good school facilitate goal many program serve underserved community","277"
"furthermore nyucd diverse patient population allow interact people different socioeconomic background","278"
"dentist wish gradually become cherish counselor confidant","279"
"realize personal contact integrate within dentistry permit unique interaction people diverse age culture background","280"
"hear many story patient horrible experience previous dentist","281"
"whether suddenly close clinic overpricing many patient good impression general idea see dentist","282"
"feel like problem practice state","283"
"dentist doctor mouth think deserve right degree respect","284"
"respect will never exist many dentist continue exploit alter treatment option benefit","285"
"honestly say whether will honest dentist country","286"
"sure will run similar temptation many dentist fall","287"
"just hope will make mistake give dentist bad reputation","288"
"couple week leave have student feel excite go final year nyucd","289"
"remember know write eportfolio back have","290"
"comment competency mostly fill sentence like sure will try good competent","291"
"now go one one feel get close real dentist laugh old comment","292"
"still cee mdr requirement fulfill do feel overwhelm","293"
"requirement will come soon late want focus provide comprehensive patient care encompass area dentistry","294"
"idea become professional change gradually last year","295"
"have have year see upperclassmen carry sort mystic aura around discuss reallife dentistry get extra tooth typodonts","296"
"time fly now almost end have year","297"
"become professional require attain appropriate knowledge skill also apply one know accordingly different situation","298"
"dentistry one area practitioner continue education life always new information technology will change treatment plan","299"
"become aware sensitive dentistry will lifelong education","300"
"idea become professional change gradually last year","301"
"have have year see upperclassmen carry sort mystic aura around discuss reallife dentistry get extra tooth typodonts","302"
"time fly now almost end have year","303"
