"Text","doc_id"
"highly scrutinize field intend live expectation","1733"
"may feel daunt know dental practitioner constantly hold high standard conduct look forward prove worthy regard","1734"
"also entail find common grind patient may agree personal level recognize humanity enough perform job good ability","1735"
"professional entail high standard academic integrity communicate other concise respectful manner time","1736"
"professionalism sense mean compromise work even though may pressure submit subpar work due pressure patient may place","1737"
"also entail find common grind patient may agree personal level recognize humanity enough perform job good ability","1738"
"feel grow exponentially past year professional school","1739"
"intimidate course load acquire skill take become dependable dentist","1740"
"involve incorporate lesson ive learn throughout year apply integrity confidence discern right wrong","1741"
"knowledge technical terminology may strong point apply selfassessment skill can improve area lack","1742"
"four year will dedicate practice build skill necessary become proficient competent dentist","1743"
"will work become wellrounded professional eager capable assist other need","1744"
"skill will acquire practice craft hone skill reach access literature continue education course ensure perform evidence base dentistry","1745"
"another important aspect curate network physician collaborate good serve patient interest","1746"
"seem everyone school understand concept ethic professional environment failure act knowledge","1747"
"shock level cheat go concern will play hit clinic floor","1748"
"hope able leave dental school know every action take accordance tell other believe sound ethical decision","1749"
"private personal statement echo state publicly addition time intention specialize","1750"
"however now interest year residency graduation order get opportunity complete procedure unable school hone skill venture","1751"
"also intend capitalize implant honour program accept spend much time can resident faculty charge department","1752"
"year dental school will shape practitioner become hope take full advantage everything nyu offer","1753"
"hard focus become professional first year mostly book learn hasnt feel different undergraduate experience","1754"
"will important find faculty trust respect prove good role model dental professional","1755"
"step role professional will require constantly look way improve knowledge skill","1756"
"will mean learn whole new language deal health care professional understand relationship doctor patient","1757"
"importantly title require live high standard clinic","1758"
"believe gain lot insight dental profession transition rd year school","1759"
"time spend faculty help understand consider professional include hurdle profession","1760"
"include every dentist personal theory mean professional agree other much","1761"
"still think radical change progress will come interact patient","1762"
"change will force define believe professional actually act concept","1763"
"enter clinic need remember bold knowledge gain still aware lot learn tutelage faculty","1764"
"completion dental school plan wholly confident dental skill acquire solid understand science back skill","1765"
"will able build positive successful relationship base respect patient colleague team member","1766"
"will plan place continue dental education graduation strong knowledge base join start dental practice","1767"
"right now intend apply gpr graduation go private practice","1768"
"will outreach incorporate future practice clear ethical code staff abide","1769"
"reflect upon first two year dental school can pin point many time ethical standard come play","1770"
"first year dental school plague many cheat issue within class test moral ground live","1771"
"often time upperclassmen share previous exam study sheet decision distribute create level play grind exam day","1772"
"2 year see many classmate go distance succeed practical competency whether mean bring preprepared tooth drill outside mouth","1773"
"us whether approach classmate challenge moral standard","1774"
"3 year quest cee mdr lead student questionable ethical decision test ethical judgement since must always remember put patient need first foremost","1775"
"love develop skill work pediatric patient","1776"
"enjoy work child private tutor work elementary junior high school child many year dental school","1777"
"past year shadow pediatrics department learn regard special way dentist must attend pediatric patient","1778"
"crucial dentist work just child additionally parent important part child treatment since help maintain dental work teach child good oral hygiene standard","1779"
"hope develop competent professional throughout experience dental school","1780"
"professional merely one know procedure tool trade professional must also act part able communicate duty patient","1781"
"observe interaction relationship dentist patient clinic hope able observe mirror relationship see patient","1782"
"community outreach develop one professional one responsible represent entire field line work","1783"
"able develop successful relationship community crucial one success future practice","1784"
"build skill serve outreach chair class council partake outreach maine past month april","1785"
"see develop professional throughout first two year dental school","1786"
"volunteer clinic assist board examination","1787"
"learn take information put together will able present patient clinic","1788"
"learn interpret literature essential skill professional always balance either buy literature say take grain salt","1789"
"patient now rd year dental school putting together skill acquire present care base upon literature everything learn dental school","1790"
"aspire dentist like ensure professional competent perform dental procedure timely nearly flawless manner","1791"
"like maintain clear path communication patient attempt destroy stigma dental visit scary ruthless experience","1792"
"like serve community volunteer service encourage people seek dental care urgent situation make routine part life preventative measure","1793"
"understand financial aspect dentistry may prevent receive treatment seek provide service reduce cost need member field interaction professional will vital success field","1794"
"one important relationship future will patient","1795"
"like ensure will fully comfortable perform dental procedure information able make choice regard dental care","1796"
"learn lot ethical moral dilemma face practice dentist","1797"
"class teach dr","1798"
"help us realize one must consider option ethical situation whats good patient","1799"
"monetary gain can drive greed many already practice dentist world today one must whats good patient order good dentist possible","1800"
"look forward experience dilemma may surface work clinic patient","1801"
"part student professionalism ethic association learn great deal meeting dentist real life ethical scenario handle properly","1802"
"go forward dental school aim able deliver comprehensive dental care variety community improve professionally good clinically","1803"
"will strive engage school student body good city around us utilize peer mentor resource available augment ability student future dentist","1804"
"future hope able practice general dentist provide preventative therapeutic care good instill healthy dental practice future patient life","1805"
"experience three year dental school far guide right path become good round dental professional","1806"
"self assessment peer assessment allow see point improvement direct need gain empathy ethic skill need","1807"
"work preclinical clinical setting gpd group allow foster great work relationship colleague build sense camaraderie teamwork","1808"
"go experience actual patient make able realize ive improve gain professional skill","1809"
"can now see communication skill patient drastically improve good hand skill critical think","1810"
"experience three year dental school far guide right path become good round dental professional","1811"
"self assessment peer assessment allow see point improvement direct need gain empathy ethic skill need","1812"
"work preclinical clinical setting gpd group allow foster great work relationship colleague build sense camaraderie teamwork","1813"
"go experience actual patient make able realize ive improve gain professional skill","1814"
"can now see communication skill patient drastically improve good hand skill critical think","1815"
"feel though grow lot dental school thus far multitude way","1816"
"strive persondentist good round regard academic excellence clinical skill communication skill","1817"
"believe three aspect critical successful dentist","1818"
"feel though improve one area since dental school time go along will able fully good round regard","1819"
"go forward dental school aim able deliver comprehensive dental care variety community improve professionally good clinically","1820"
"will strive engage school student body good city around us utilize peer mentor resource available augment ability student future dentist","1821"
"future hope able practice general dentist provide preventative therapeutic care good instill healthy dental practice future patient life","1822"
"trust ethic moral value integral part good society","1823"
"oral health care provider responsible stick onto high norm trust ethic moral value","1824"
"will build good relationship us patient member society community","1825"
"keep aspect life maintain high norm","1826"
"like treat patient utmost care respect compassion","1827"
"like deliver good treatment possible consider overall health social cultural financial condition","1828"
"also like take responsibility bring awareness community","1829"
"work team effective way bring change mass rather work individually","1830"
"always try hone personality skill knowledge grow term professionalism personality","1831"
"grow attitude learn never end","1832"
"attitude will help grow professionally personally","1833"
"feel grow professionally grow just term education also term behavior attitude","1834"
"responsibility us professional help other profession patient professionally also bring pride profession","1835"
"every learn experience need accept deliver quality care utmost professional way","1836"
"professional responsible deliver hisher task effectively efficiently whatever profession","1837"
"professional just responsible deliver task also represent profession good way possible","1838"
"professional also responsible society help society whatever way possible","1839"
"strongly believe maintain professionalism","1840"
"professional day learn day","1841"
"person think know everything doesnt need learn anymore stop grow professionally instead bring harm also community","1842"
"learn constantly possible important able deliver quality care","1843"
"need able use recent advancement dentistry deliver unmatched care","1844"
"believe prevention good cure","1845"
"commit help patient understand importance overall oral health role oral health","1846"
"confident will able learn knowledge recent treatment option technique also learn skill essential dentist become successful","1847"
"always provide like provide compassionate care patient like family treat other","1848"
"always believe lot learn dentistry","1849"
"take constructive criticism improve become good person","1850"
"believe opportunity make difference other life bring smile face fulfill reward","1851"
"need learn gear knowledge experience bring smile patient face utmost gratify","1852"
"follow ethic course dr","1853"
"believe ethic ethical decision important classroom set also clinical set importantly dental practice graduate","1854"
"believe honesty follow rule","1855"
"although student often incline take action witness unethical action hope able step forward confront student personally","1856"
"although comfortable involve peer review board faculty hope can less address student","1857"
"importantly hope able follow rule nyucd make unethical decision classroom towards patient","1858"
"believe provide good possible health care important hope make ethical sound decision involve patient peer","1859"
"past two year nyu really teach lot","1860"
"have able completely focus didactic course feel excel","1861"
"however have struggle","1862"
"balance classwork lab work turn really difficult","1863"
"realize although good didactic course struggle lab","1864"
"fail cr turn bless disguise","1865"
"disappoint first really show need spend much time lab afraid ask help","1866"
"think experience make comfortable clinic ask peer faculty help","1867"
"first pulp exposure last week really learn thing happen clinic lab just make good situation even initially intend","1868"
"become professional professionally competent field dentistry mean wellrounded individual","1869"
"professional thorough understand knowledge dentistry sufficient experience clinical set able treat patient","1870"
"professional learn appropriate way treat patient peer colleague good provide good possible oral health care other","1871"
"welleducated perform good classroom set also preclinic clinic rotation","1872"
"professionally competent individual honest ethical hard worker","1873"
"importantly become professional field dentistry mean putting patient first","1874"
"hope able accomplish goal graduate nyucd become professional","1875"
"become professional professionally competent field dentistry mean wellrounded individual","1876"
"professional thorough understand knowledge dentistry sufficient experience clinical set able treat patient","1877"
"professional learn appropriate way treat patient peer colleague good provide good possible oral health care other","1878"
"welleducated perform good classroom set also preclinic clinic rotation","1879"
"professionally competent individual honest ethical hard worker","1880"
"importantly become professional field dentistry mean putting patient first","1881"
"hope able accomplish goal graduate nyucd become professional","1882"
"believe really excel professional progress","1883"
"timid first go clinic now much excite will learn","1884"
"love interact patient treatment plan great joy see much progress","1885"
"past two year nyu really teach lot","1886"
"have able completely focus didactic course feel excel","1887"
"however have struggle","1888"
"balance classwork lab work turn really difficult","1889"
"realize although good didactic course struggle lab","1890"
"fail cr turn bless disguise","1891"
"disappoint first really show need spend much time lab afraid ask help","1892"
"think experience make comfortable clinic ask peer faculty help","1893"
"first pulp exposure last week really learn thing happen clinic lab just make good situation even initially intend","1894"
"competent dental professional entail many serious responsibility moral standard","1895"
"confident good judgement moral foundation","1896"
"face ethical decision career personal life expect always take consideration principle ethic strive good patient","1897"
"goal become always confident competent everything","1898"
"also aim efficient practitioner","1899"
"interest cosmetic dentistry periodontics","1900"
"remainder have year have year come hope improve ability work pressure time managment efficiency","1901"
"also aim improve academic record strive improve gpa","1902"
"life acquire good foundation expect professional","1903"
"will acquire knowledge become competent experience dental school include faculty peer interaction class peer self assessment clinic patient interaction","1904"
"believe experience especially rough time tough situation next year will mold professional want expect dental profession","1905"
"believe will evaluate competency various source","1906"
"besides faculty evaluation competency test will evaluate peer mentor level besides technical skill","1907"
"ethic behavior communication will evaluate thing make competent professional equally important quality","1908"
"also patient evaluation work provide different evaluation different perspective","1909"
"one area struggle time management skill","1910"
"extremely detail orient sometimes always positive thing easily find catch small detail routinely go leave unnotived negligible effect outcome","1911"
"hope improve achieve balance","1912"
"life acquire good foundation expect professional","1913"
"will acquire knowledge become competent experience dental school include faculty peer interaction class peer self assessment clinic patient interaction","1914"
"believe experience especially rough time tough situation next year will mold professional want expect dental profession","1915"
"aside faculty evaluation competency test assess peer mentor level besides manual skill","1916"
"ethic behavior communication will evaluate thing make competent professional equally important quality","1917"
"dental school course exponential academic personal growth","1918"
"start clinic realize little actually know","1919"
"really bring new perspecitve much room grow much learn","1920"
"great experience look forward progress come","1921"
"aim become confident competent oral health practitioner able build last relationship colleague mentor patient","1922"
"time school clinic crucial learn balance skill build meaningful patientdoctor relationship still learn efficient work business set","1923"
"important us decide kind dentist colleague want perceive","1924"
"hope grow person practitioner eventually transition gpr program sstate new york","1925"
"patient believe correct ethical grind healthcare professional give","1926"
"go situation personal interest will conflict ethical code follow","1927"
"professional oral care provider mean put patient center progression become dentist","1928"
"will help us solidify identity ethical situation determine personality professional career","1929"
"ethic clinic set little bite different","1930"
"want able good patient sometimes patient factor prevent","1931"
"example just patient receive crown approve financial manager prior send fabrication","1932"
"crown deliver receive email state crown cover patient will bill accordingly","1933"
"feel patient wrong force pay procedure preapproved time something can rectify","1934"
NA,"1935"
NA,"1936"
"become professional mean strive become competent oral healthcare provider","1937"
"competent dentist need great skill hand also encompass various skill","1938"
"establish foundation communication ethic integrity respect critical develop great dentist excel manual proficiency also deliver high level care good way possible","1939"
"reflection hasnt change since have","1940"
"have year difficult yet fruitful experience professional progress","1941"
"didactic course provide histology physiology body system preclinic course expose us fundamental concept dentistry learn experience procedure will perform future","1942"
"ethic have leadership seminar sapl clinical seminar provide us information can help us build identity professional healthcare provider","1943"
"have year probably difficult academic year entire career","1944"
"however help change cram study habit balance one","1945"
"introduction clinic nervewrecking first get use","1946"
"have year start really slow im begin catch pace","1947"
"use content patient lodge locker room area now try hard see patient force busy","1948"
"several goal dental student nyucd","1949"
"want develop good study habit organization skill necessary match rigorous curriculum","1950"
"primary focus learn craft great handson dentist","1951"
"wish excel clinical lab set good academic course","1952"
"want create strong network inside outside school can hopefully last throughout dental school","1953"
"graduation wish competent passionate friendly professional provide care oral health new york city","1954"
"want dentist patient can trust issue oral health issue good","1955"
"finish hard academic year career ready shift focus good clinician","1956"
"clinic slow start change way push good work hard","1957"
"personal goal have year constantly work gain clinical experience","1958"
"ethic can become challenge sometimes patient treatment clinic","1959"
"requirement meet competency take sometimes may find draft elaborate treatment plan patient actually need order benefit","1960"
"however health professional must keep mind patient interest","1961"
"far really keep ethical standard do something patient wish","1962"
"ethic communicate patient alternative treatment plan let decide go do","1963"
"ethic whats objectively right patient try change patient personal perspective may detrimental health","1964"
"ethical professional mean whats morally objectively right patient time despite condition can influence one personal opinion","1965"
"now im officially treat patient clinic hope integrate everything ive learn thus far year dental school present competent knowledgeable ethical health practitioner","1966"
"besides right skill treat patient discover effective communication patient management skill can make experience treat patient much enjoyable college","1967"
"patient tell theyre motivate come visit time ready treatment can get partial denture quick","1968"
"patient first visit excite treat educational environment plenty faculty around check work student ensure good quality work produce","1969"
"however hear average can take minimally month set denture complete time material send back forth lab just tend disappear","1970"
"manage patient always explain pro con procedure need always sound knowledgeable","1971"
"always able communicate effectively term need certain kind treatment expect next","1972"
"nonetheless still one two stubborn one will say yes everything fail next two appointment","1973"
"explain doesnt work just kind put patient aside just ignore completely reach schedule appointment","1974"
"even make appointment will still warn fail appointment one time will remove permanently roster","1975"
"first start clinic wouldnt manage patient way","1976"
"treat everyone nicely wouldnt retaliate even certain patient fail show twice","1977"
"however eventually become feed kind patient ruin clinical experience able get anything do","1978"
"now become mean say finally whip patient shape","1979"
"wont let one bad apple ruin clinical experience patient stick front faculty great doctor every aspect","1980"
"regardless whether patient choose continue treatment school always get comment every new patient always make feel welcome always take time communicate do just feel like object drill","1981"
"time get brace orthodontist teenager see much improve smile bite remove know interest field dentistry can provide immediate positive result patient","1982"
"successful health professional require fine balance nice empathetic patient time forget one knowledge whats good","1983"
"professional mean act ethical professional manner place patient good interest","1984"
"doesnt mean perform technical aspect field efficient manner also mean communicate behave professional way","1985"
"professional always treat everyone equally let personal emotion influence decision task hand","1986"
"professional one competent knowledgeable specific subject area","1987"
"professional also someone treat everyone equally put aside one personal bias perform task","1988"
"progress see past year dental school improve communication skill","1989"
"never think communication interpersonal skill important first two year didactic study","1990"
"now discover communication important enable patient understand understand appreciate service provide","1991"
"ive learn expressive just assume people know im think time","1992"
"now treat patient clinic month now professionally mature empathetic care health professional","1993"
"usually one speak slowly express thought however front patient always take time now explain dental concept make sure know whats go theyre comfortable proceed give procedure","1994"
"even though im still process improve skill various dental procedure never expose still able retain friendly rapport patient trust treat","1995"
"confidence enable feel much comfortable im","1996"
"throughout progression year clinic develop mature understand health professional","1997"
"deal patient different background personality acquire interpersonal skill improve communication","1998"
"everything new learn experience","1999"
"now officially transition clinic start treat patient find grow mature health practitioner","2000"
"use just memorize information solely purpose acing school exam","2001"
"now apply theoretical principle learn class case case basis manage patient","2002"
"strive now become good round clinician one can hold accountable action one whats good patient time","2003"
"almost whole year start treat patient clinic","2004"
"good satisfaction able improve patient oral health smile clinician make special difference","2005"
"besides technical aspect dentistry find patient pay attention much care much know","2006"
"im glad know im dental technician patient also friend can lend ear actually listen say good","2007"
"now im rise have definitely become familiar clinical procedure confident work","2008"
"mature last year clinic","2009"
"acquire much practical knowledge clinic faculty get textbook alone","2010"
"experience really conform say good learn experience actual practical application various procedure","2011"
"ethic morality sense right wrong many important component like harm justice etc","2012"
"always try maintain ethical professional conduct patient peer professor","2013"
"try self assess can cant","2014"
