"Text","doc_id"
"professional better one self also help other good can","3196"
"ultimate goal provide good care possible patient","3197"
"accomplish goal will need clinically competent able communicate clearly coworker patient professional field","3198"
"also think important continue education dentistry dental school establish professional network dentist","3199"
"like practice general dentistry plan year gpr graduation gain experience","3200"
"eventually like open practice","3201"
"always moment feel can cut corner thing fast easy simple way","3202"
"may work may go unnoticed true moral grit come","3203"
"idea right commit define true professionalism","3204"
"first foremost serve lord whatever way see fit","3205"
"goal support family financially emotionally promote overall healthy happy successful life us","3206"
"want able become involve local community","3207"
"also want change diversity find profession dentistry","3208"
"like increase amount african american dentist academia practice within unite state","3209"
"many thing ’ have learn thus far also feel just much don ’ t know","3210"
"feel confident many aspect know thing clueless","3211"
"worry thing unsure may problematic","3212"
"fortunately recognize another year nyucd gpr help continue round development","3213"
"feel grow many sense weak","3214"
"gain clinical skill apply learn didactic course","3215"
"also proud way grow communicator patient make feel confident ability comfortable receive care","3216"
"still need work schedule followup ’ be way","3217"
"impact world good promote oral healthcare knowledge","3218"
"local national global effort will use help achieve advancement overall quality life","3219"
"goal change way patient view dentistry importance life","3220"
"time encounter patient like make feel comfortable confident safe can deliver good treatment good appreciation care","3221"
"strive able put aside personal belief order provide treatment every person deserve human","3222"
"want concrete understand people different life style will time career find provide everyone equal right treatment without break boundary culture","3223"
"year nyu strive evolve love dentistry passion find confirmation select right path follow career","3224"
"round specialty will make nyu want find career will make happy also continuously challenge year come","3225"
"want receive proper amount education instruction order feel comfortable skill set perform dentistry confidently","3226"
"hope make friendship will stick year can use future profession","3227"
"strive strengthen understand different culture order properly treat patient come different background","3228"
"want able make certain decision base professional opinion patient need patient want order find balance optimal treatment patient satisfaction","3229"
"strive strengthen understand different culture order properly treat patient come different background","3230"
"want able make certain decision base professional opinion patient need patient want order find balance optimal treatment patient satisfaction","3231"
"learn manage time efficiently make time","3232"
"always strive get need do take time big aspect professional","3233"
"feel confident perform basic moderately advance dental procedure without maor assistance faculty","3234"
"year nyu strive evolve love dentistry passion find confirmation select right path follow career","3235"
"round specialty will make nyu want find career will make happy also continuously challenge year come","3236"
"want receive proper amount education instruction order feel comfortable skill set perform dentistry confidently","3237"
"hope make friendship will stick year can use future profession","3238"
"want practice integrity one know commitment give patient good care possible ethical mean","3239"
"want provide good possible healthcare everyone just patient compliant","3240"
"especially important provide care individual difficult treatwhether medical condition socioeconomic status resistance care","3241"
"want able start organization give access dental care area population just occasion continually","3242"
"want able lead organization career grace kindness resourcefulness","3243"
"think important know interact people especially disagree want voice hear","3244"
"think thats something lot classmate struggle choice seem voice hear conduct professionally reality challenge conduct professionally voice hear","3245"
"especially difficult treat patient many will try steer course appointment care ive find really important assert role care giver professional field ultimately youre","3246"
"provide ethical dental treatment patient","3247"
"important want make sure patient good knowledgeable give patient put good hand ethically","3248"
"will ton scenario will come across dentist important always know youre control dental treatment irregardless patient request","3249"
"otherwise request make ethically must deny treatment tell go elsewhere","3250"
"become competent professional look obtain extensive knowledge field dentistry coursework clinical practice","3251"
"great communication skill one important attribute need respectful culturally aware communicate way earn trust","3252"
"want gain experience communicate patient technique skill","3253"
"excellent profession want passionate want show patient healthcare professional passion towards career","3254"
"will earn trust leave good impression around","3255"
"must use evidencebased dentistry treat patient","3256"
"peer assessment aspect course become aware carry professional","3257"
"society constantly judge main appearance talk other","3258"
"implement motivate carry professional dentist day despite ever pick dental instrument","3259"
"look syllabus like curriculum incorporate handfull course strive us professional instead course focus science dentistryrelated","3260"
"feel will prove beneficial actually interact communicate patient assessment mean lot","3261"
"now clinic feel like ive grow ever grow short period time professionally ethically","3262"
"patientdentist interaction lot strong feel confident interact patient","3263"
"mission professional competent dentist","3264"
"want treat patient good patientcentered care efficiently communicate patient good oral health care team","3265"
"addition want strong network fellow dentist healthcare professional doctor nurse unlimited resource go","3266"
"healthcare professional want good advocate towards oral health participate community program","3267"
"lastly student difficult program want balance lifestyle make time friend time relax","3268"
"want provide good dentalcare patient","3269"
"ive work clinic now almost year feel like ive make tremendous progress","3270"
"still procedure ive never attempt im happy progress","3271"
"deliver complete denture two partial denture","3272"
"im happy way turn","3273"
"invisalign patient happy treatment far excite progress make","3274"
"overall im happy work ive know lot learn lot progress make","3275"
"important trait health care professional must possess ethical","3276"
"heath care professional must know difference right wrong time ethical","3277"
"essential become competent professional","3278"
"past year learn always whats ethical righteous","3279"
"do entire clinic floor even entire school will hear sketchy unethical thing do","3280"
"cant wait graduate use skill knowledge gain nyu","3281"
"skill will extremely valuable rest career","3282"
"will allow excel achieve goal dream make competent dentist one day","3283"
"professional consist competent skillful profession importantly behave ethical way","3284"
"also include honest good responsible","3285"
"must always put put patient first","3286"
"clinic almost entire year realize important give good first impression","3287"
"good first impression can make difference get treatment do patient can meet mdr cee requirement never show","3288"
"professional consist competent skillful profession importantly behave ethical way","3289"
"also include honest good responsible","3290"
"must always put put patient first","3291"
"clinic almost entire year realize important give good first impression","3292"
"good first impression can make difference get treatment do patient can meet mdr cee requirement never show","3293"
"feel like still lot learn","3294"
"dental school provide basic fundamental dentistry","3295"
"however know still much learn","3296"
"gain valuable experience clinically didactic order competent future dentist","3297"
"cant wait graduate worry cees mdrs","3298"
"want able joyfully enjoy rather rush thing just meet deadline meet requirement","3299"
"believe everyone honest take responsibility action especially patient care","3300"
"student motivate other improve become good dentist","3301"
"stressful circumstance tempt something thats beneficial patient happen student must try good serve patient good interest","3302"
"slowly surely close goal","3303"
"hold high standard have like continue momentum follow year","3304"
"update still standard have now","3305"
"professional must maintain high standard clinic good every day life","3306"
"community public will assess constantly expect behave way exceed standard","3307"
"enter clinic find live standard hopefully maintain along way","3308"
"believe achieve lot have year","3309"
"still remember first time see patient anxiety tremendous","3310"
"now eager see patient provide serve professional way","3311"
"goal become someone backbone community health care","3312"
"want become someone patient trust believe way towards","3313"
"goal become competent dental professional strive provide excellent patient care advocate promote preventive care importance oral health","3314"
"want serve educate underserved community participate local global outreach program hope make difference community","3315"
"just begin long journey","3316"
"feel competent treat pt different culture will learn work","3317"
"like learn much can dental school","3318"
"will apply knowledge future patient care business management","3319"
"will learn pt care emergency pt management","3320"
"fall comfortable talk pt provide good care still need work hard","3321"
"feel competent confident treat pt still need work get experience","3322"
"goal able professional dentist practical business aspect","3323"
"mean fulfill patient chief complaint also find condition underlie concern patient may","3324"
"remain year nyucd want maintain good academic stand","3325"
"want treat patient various need","3326"
"want learn diagnose treatment plan complex case","3327"
"want gain exposure many different type treatment experience handson implant placement","3328"
"want come school selfsuffcient competent dentist","3329"
"will continue learn graduation ultimately provide good care patient","3330"
"will always try relate future patient understand honesty professionalism will support way health good","3331"
"learn professional patient keep distance let private problem overtake overwhelme","3332"
"know will great challenge will require hard work lot time","3333"
"just hope will enough time require able spend time daughter","3334"
"will good will work hard graduate become confident professional want set good example daughter want understand nothing come easy hard work honesty can achieve goal","3335"
"can add statement now almost do have everything say true hard work get have have challenge make time family lot time feel like give keep say end will worthed","3336"
"want able achieve confidence professionalism excellent manual dexterity will allow successful dentist open door specialization","3337"
"now have want add statement good","3338"
"clinic get busy time go every day realize right profession love every day wait graduate employ skill learn school","3339"
"thank nyu become have excite process every day learn something new become confident professional towards patient","3340"
"gain knowledge skill comfortable almost procedure","3341"
"accept nyucd one step close main goal become dental professional know challenge hard road front know will overcome every rock way believe honesty hard work empathy towards profession","3342"
"become professionally competent course nyu teach much appreciate every single course competency make confident everything clinic","3343"
"ethic essential work field want reliable individual patient can depend","3344"
"treat patient past year clinic believe make ethical decision try help patient","3345"
"mission throughout next year dental school become ethical confident individual patient can rely","3346"
"throughout gds lab many practice driling fill become confident skill will pursue become dentist great dexterity","3347"
"first year dental school pass significantly improve handskills reflect upon practical grade","3348"
"rate confident will become competent will pursue become confident reliable dentist","3349"
"clinic outcome treatment patient reflect professionalism competent handle patient care","3350"
"constant opportunity able prep restore tooth lab allow become competent hand skill","3351"
"treat patient clinic learn become competent communicate patient provide good care","3352"
"believe progress immensely become professional individual","3353"
"improve treat patient also able communicate give good care can get","3354"
"mission throughout year dental school become confident individual able practice also knowledge educate share other also build communication skill will allow help patient comfortable","3355"
"3 year dental school believe road achieve goal","3356"
"will give good effort utilize vast diverse patient population nyucd gain clincal knowledge experience will become important foundation future career proficient competent practitioner","3357"
"give good effort become competent dentist many aspect","3358"
"clinical experience improve skill deal challenge patient entheusiastic dental treatment","3359"
"clinical experience various patient experience dentistry broad scale","3360"
"clinical communication skill improve good ablity practitioner offer good care patient","3361"
"will good effort become competent dentist can proficient treatment manage tooth also leader health care","3362"
"will give good effort obtain foundation knowlege skill become competent proficicient practitioner","3363"
"ethically im everything can try save unnecessary spend patient treatment save unnecessary treatment good","3364"
"want serve society time want make lot money","3365"
"think im right track become professional learn patient care clinic different way serve simbench lab","3366"
"im feel confident treat many different patient learn previously","3367"
"think im right track become professional learn patient care clinic different way serve simbench lab","3368"
"im feel confident treat many different patient learn previously","3369"
"im good progress become professional will feel much confident time graduate","3370"
"procedure im confident due lack experience im sure ill fulfill need time graduate","3371"
"goal become general dentist can serve people society","3372"
"love","3373"
"feel become professional mean need grow responsible come due date","3374"
"also get priority line something im currently work","3375"
"sometimes disbelief think future store","3376"
"will lot weight hold will position people come health need will one need know answer","3377"
"worry may know answer do know will reflect professional","3378"
"part nyucd class plan expand horizon contribute community meet new people make life long connection","3379"
"furthermore plan build communication skill grow mature mentally physically experience new endeavor around world","3380"
"enter nyucd student will learn experience many new thing look forward leave change person professional","3381"
"take ethic class similar class learn important think professional ethically personal life good","3382"
"clinic need decide good option treat patient whether need treat periodontic endodontic extract","3383"
"need consider patient insurance budget need meet patient satisfaction dental health","3384"
"clinic will try save patient tooth possible make healthy","3385"
"will follow point money either school office will explain good option patient","3386"
"although deal lot ethic dilemma clinic come treatment plan can satisfy term patient health finance time","3387"
"sometimes compromise situation","3388"
NA,"3389"
NA,"3390"
"become professional dentist will keep passion dental field","3391"
"school will learn everything can competent dentist academically clinically","3392"
"first 2 year will focus academic knowledge will enhance hand skill simulation lab","3393"
"get confident knowledge skill will make easy treat patient end 2 year","3394"
"throughout year will behave professional time respectful communication understand different culture","3395"
"take clinic relate class feel understand information apply patient really important become professional dentist","3396"
"year since first day nyucd","3397"
"many compact class one semester imagine undergraduate","3398"
"build basic science knowledge anatomy biochemistry cell biology first semester","3399"
"learn depth structure enamel dentin root cementum organ neuroscience relate dental 2 semester","3400"
"meanwhile gain dental skill gds class now able perform preparation restoration caries tooth","3401"
"class health promotion multidisciplinary radiology learn clinic fill chart communicate patient good","3402"
"2 year dental school learn pro perio endo restoration etc depth become professional dentist","3403"
"clinic now information learn many class useful can apply patient","3404"
"goal nyu college dentistry competent dental profession can respect trust colleague professor patient","3405"
"confident dentist want gather dental health care information much can want make informative website different language keep people healthy","3406"
"professor want learn manage dental clinic develop excellent bond patient team member","3407"
"clinic priority now educate patient good oral hygiene suffer decay","3408"
"time try give good treatment option include financial issue good","3409"
"individual moral code guide decisionmaking","3410"
"one ethical standard everyone follow important realize deal patient may view situation hand way","3411"
"think ethical mean respectful uniqueness everyones moral code understand work together reach common goal","3412"
"have edit change","3413"
"mission gain academic technical confidence throughout four year university","3414"
"will strive take full advantage diverse patient base school offer will good establish maintain strong relationship classmate mentor advisor","3415"
"will try good keep track will approach study hard work passion dedication edit have mission become wellrounded clinician confident deal patient different need personality","3416"
"will try treat many patient can whatever remain time","3417"
"goal build strong clinical foundation learn much can help faculty peer","3418"
"hope improve upon interpersonal skill peer good patient order establish meaningful relationship will strengthen passion profession good help get professional education","3419"
"also hope expand already increase knowledge base order gain confidence treat patient","3420"
"additionally hope improve upon manual dexterity skill technical ability","3421"
"have edit critical learn many procedure possible order gain strong foundation provide treatment also important see many different type people possible gain experience deal different personality patient variety need","3422"
"become professional mean strong knowledge base excellent clinical skill provide good patient care possible","3423"
"professional able treat patient ethical manner able communicate patient culturally respectful way","3424"
"hope increase knowledge field dentistry improve upon clinical skill learn communicate patient compassionate way","3425"
"have edit professional also mean putting patient need first able address chief complaint provide good possible treatment option patient","3426"
"feel gain great deal knowledge basic science conservative classical preparation hope improve manual dexterity skill build upon grow knowledge base field dentistry","3427"
"also hope improve upon communication skill","3428"
"have edit feel need clinical experience hope gain work hard clinic session make sure can stay target fall behind","3429"
"hope see patient can get good communication interpersonal skill","3430"
"throughout four year university strive become confident technically skill dental professional demonstrate passion field strong understand clinical knowledge require competent practitioner","3431"
"hope participate global outreach program order gain exposure different culture become wellrounded practitioner edit have goal remain time nyucd make time clinic","3432"
"hope gain much knowledge experience possible work faculty utilize time full","3433"
"also strive gain speed complete procedure experience faculty practice","3434"
"brainer","3435"
"ethical","3436"
"do cheat","3437"
"take responsibility","3438"
"member class havent get memo seem","3439"
"will always take pride ethic","3440"
"shortcut cheat","3441"
"honesty first","3442"
"always","3443"
"edit compliment clinic honesty ethic","3444"
"look like im right path","3445"
"heres deal care life get next year dental school","3446"
"yes want grow professional yes want make friend successful","3447"
"want anything simply make program","3448"
"always poor study habit get stress easily need make sure can manage time emotion effectively","3449"
"just want prove capable take make grueling year","3450"
"year make side can call dd will do everything ive seek accomplish","3451"
"edit sentiment still though edit make","3452"
"im worry study anymore ive get","3453"
"however worry learn bunch nitpicky knowledge","3454"
"ultimately just want knowledgeable matter will pass board","3455"
"ive learn something 3 year dental school turn doesnt matter color hair talk little loud people","3456"
"know","3457"
"ive rainbow hair now month do try hide patient now excellent group patient respect feel comfortable open","3458"
"far im concern long dress appropriately never forget stiletto act appropriately truly care patient work hard can everyone problem can shove","3459"
"hide conform","3460"
"become professional simply proficient career path way behave elevate public eye","3461"
"professional require ethical relatable knowledgable behave prudent respectable manner","3462"
"personally think everything except behavior aspect","3463"
"say behave badly rather believe casual other","3464"
"think speak loudly blunt forward","3465"
"learn speak properly patient colleague will primary objective hopefully grow decorum will strengthen aspect professionalism feel already","3466"
"have do absolutely crush","3467"
"excellent grade awesome performance preclinic","3468"
"now transfer patient","3469"
"look much good now time year ago","3470"
"have edit have hard really hard","3471"
"grade okay par nd year","3472"
"point couldnt care little academic","3473"
"just want get right clinical knowledge make sure patient good care","3474"
"far im concern every drug prescription memorize unnecessary waste time","3475"
"will continue press patient care hope will get noshowed much use can get even close ridiculous cee requirement set us","3476"
"time nyu will strive become clinician worthy serve us navy","3477"
"hope establish maintain close relationship peer","3478"
"will focus ethic order practice integrity","3479"
"will develop communication skill order effectively charismatically interact patient","3480"
"will use skill aid humanitarian effort","3481"
"will become contribute member community will assist provide care area limit access","3482"
"serve time navy will consider explore avenue academia possibly research education","3483"
"also supplement education research opportunity opportunity gain experience complete general practice residency","3484"
"ethic lie heart true professional","3485"
"must always ethic lean help navigate problem may face","3486"
"work hard sound competent professional hope gain experience knowledge necessary develop maintain strong ever grow business","3487"
"business focus provide high level patient care","3488"
"become professional adopt lifestyle become aware action susceptible public opinion","3489"
"one must continue work become complete professional throughout one career late life","3490"
"become professional ongoing process involve constant reflection one action","3491"
"look back action make adjustment need","3492"
"make much progress three year student","3493"
"feel like amount work responsible give opportunity feel pressure professional","3494"
"responsible work good outward appearance conduct","3495"
"3 year responsible get work patient need do timely fashion","3496"
"time management professional tenacity thing need work","3497"
"wish work hard become good dentist can process develop strong personal relationship strong clinical ability deep passion volunteer work improve everyday professional","3498"
"feel ethic incredibly important part healthcare professional type professional matter","3499"
"people health wellbeing often time finance control responsibility uphold certain ethical standard","3500"
"take advantage patient vulnerability lack knowledge morally wrong person call professional","3501"
"have update still outlook ethic first write","3502"
"yet experience anything clinic involve serious ethical issue hear story colleague ethically challenge","3503"
"think clinical experience get will challenge ethical outlook will grow develop","3504"
