"Text","doc_id"
"know will ultimately lead good decision treatment patient","4752"
"come realize maintain moral ethical integrity vital ensure happiness provide good care patient","4753"
"four year nyu hope put forth good effort didactic study utilize knowledge practice","4754"
"want make sure get four year school can become good dentist can become","4755"
"hope practice communication skill build good work ethic ultimately become competent reliable professional will provide good dental care patient","4756"
"feel much confident clinical ability good ability connect communicate people","4757"
"know will learn much follow year please progress","4758"
"recent month clinic prepare much path become professional","4759"
"whether respond patient phone call timely manner fully explain procedure good ability definitely take stride become professional","4760"
"feel utmost importance dentist just provide excellent oral healthcare also professional","4761"
"dentist role model rest community must uphold great responsibility moral integrity","4762"
"much want white coat agree nyucds decision postpone white coat ceremony till 2 year","4763"
"definitely think take time effort become professional","4764"
"ultimately hope become dentist future professional patient can comfortably rely trust","4765"
"feel come long way thus far even though one year since start dental school","4766"
"feel much confident clinical ability good ability communicate patient fellow classmate professor","4767"
"update feel much confident clinical ability compare have","4768"
"tooth color prep temp competency happy result","4769"
"take competency wasnt nervous compare nervous wreck have practical much confident","4770"
"still much learn practice happy progress","4771"
"update definitely feel experience various procedure include post core good srp","4772"
"update near end 3 year feel confident ability simple restorative procedure class restoration","4773"
"interest note work amalgam yet even though one first thing teach dental school","4774"
"im process finish first complete denture","4775"
"want experience endodontics fix prosthodontics although im start another root canal late week","4776"
"four year nyu hope put forth good effort didactic study utilize knowledge clinic have have","4777"
"want make sure get four year school can become good dentist can become clinical skill bedside manner","4778"
"hope practice communication skill build good work ethic ultimately become competent reliable professional","4779"
"do just want become good dentist excellent one consistently strive provide absolute good care patient","4780"
"ethically competent take lot effort consideration","4781"
"patient unique unique background cultural experience ethical value","4782"
"patient treat individual","4783"
"obligation find much possible patient provide good possible patient care ethically","4784"
"ethic dynamic one patient principle can apply patient","4785"
"goal competent health care provider able come good treatment plan individual patient properly solve ethical dilemma ill face effective communication health care specialist colleague","4786"
"meanwhile try learn much can faculty lecturer expose different patient case situation able provide competent patient care graduation","4787"
"faculty role model kind dentist want become learn good skill day day","4788"
"goal achieve excellence patient care gain good possible hand dexterity improve ability effectively communicate people different cultural background","4789"
"want active explorer dental field participate dental research different outreach program actively learn professional field","4790"
"want dentist patient trust will treat","4791"
"dental student try contribute school dental profession gain knowledge experience unique cultural background","4792"
"course dental school take numerous course teach us ethical law know abide","4793"
"give good base future feel like trust instinct right versus wrong will lead right direction","4794"
"next year want academically successful also know embrace opportunity outside academic","4795"
"past ive content just bite average feel like point life like excel never feel hold back thing couldve do differently","4796"
"id like someone know someone get thing do confident ability","4797"
"want also set high goal always constantly learn strive excellence","4798"
"want push thing comfort zone confident ability adapt learn new situation rather cautious approach","4799"
"final year push get good residency program figure next chapter life will","4800"
"hope make seemingly risky decision rather seem safe comfortable option","4801"
"become professional constantly see knowledge further certain field","4802"
"think hard say next year will learn everything will need competent practitioner goal try learn everything can school continue quest knowledge move career always date late study technology","4803"
"want provide good appropriate care patient constantly educate way will get","4804"
"want know situation good patient process learn work become good practitioner","4805"
"addition want push professionally","4806"
"begin develop interest practice management thing get overwhelm real world hope still maintain interest develop professionally","4807"
"professional field signify commitment make gain knowledge proficient dedication constantly learn improve field","4808"
"graduate dental school will basic set knowledge field dentistry need continue build upon grow","4809"
"also feel professional dentistry important dedicate grow field become stagnant obsolete","4810"
"another aspect professionalism dedication patient care","4811"
"regardless situation obligation present treatment option without bias","4812"
"build skill feel ce course incredibly important order keep build basic learn school","4813"
"last year ive learn lot professionally","4814"
"ive learn different thing value peersfriends around","4815"
"touch upon feel still long way go","4816"
"finally feel like point can try new procedure without fail miserably feel confident enough take chance","4817"
"need go place can build confidence skill can instill trust patient","4818"
"next next year many goal like aim towards","4819"
"want gain confidence ability level afraid display skill","4820"
"want stop regret embrace new experience utilize resource available good ability","4821"
"want actually feel like give challenge im face content give","4822"
"want mentally challenge know can take successful","4823"
"one thing resonate hope embrace future take opportunity present whether feel like qualify","4824"
"addition hope good able manage time efficient manner organize patient schedule optimize care","4825"
"now enter final chapter nyucd become good inform prepare clinician prime goal","4826"
"basic skill knowledge competent health care provider go goal go beyond constant quest knowledge","4827"
"follow golden rule","4828"
"treat other want treat","4829"
"also never ask other thing im will even rule book","4830"
"ive see student th floor do unethical thing","4831"
"suppose stress behave defensively","4832"
"do want mistreat people nice thing","4833"
"will stay focus work hard stay people way","4834"
"will show everyone respect speak politely show respect","4835"
"month since ive work clinic","4836"
"always treat patient respect put need mine","4837"
"feel behave accordance golden rule other wish youd like ill problem make ethical decision","4838"
"havent make ethic violation do intend","4839"
"ethical require mindset respect everyone around","4840"
"will keep practice dentistry accordance ethic code dental school","4841"
"want get dd degree move one life","4842"
"now ive clinic month","4843"
"realize many thing do know know know do know much","4844"
"goal remainder dd education learn much can graduate","4845"
"dental school give foundational knowledge student student proactive life long student order stay relevant ever change dental field","4846"
"goal remainder have school year good communicator towards peer","4847"
"many time im approachable id like towards peer colleague feel tire stress","4848"
"top focus remainder academic collaborate colleague im clinic","4849"
"state become professional mean will learn people","4850"
"lesson take home end day able mold mature respectful knowledgable studentdentist","4851"
"professional take hard work","4852"
"take lot selfawareness discipline behave manner consistent nyucds policy good satisfy patient expectation","4853"
"time act way think slightly set nyucds policy","4854"
"feel regret mistake","4855"
"yet time mistake chance help improve","4856"
"guess become professional something take time lot hard work","4857"
"constantly try good healthcare professional","4858"
"help faculty peer will good train dentist take care patient good ability","4859"
"realize time feel like people group practice behave unprofessionally","4860"
"learn mistake do make mistake theyve make","4861"
"also try put shoe try see perspective","4862"
"way think help see issue multiple angle","4863"
"thus allow diplomatic conflict resolution confront unprofessional behavior display student","4864"
"person become professional person must assume responsibility hisher action","4865"
"believe rest will take care","4866"
"professional mean student will work good student faculty patient show respect courtesy order achieve high possible academic clinical learn standard possible","4867"
"im work become good professional everyday lot learn peer","4868"
"please help teach together good help everyone learn","4869"
"behave professionally clinic set time challenge","4870"
"sometimes ive see people talk bite loud make inappropriate comment ive certainly catch time talk little bite loud late appointment","4871"
"certainly didnt feel good","4872"
"theres always room improvement","4873"
"big part become professional always strive learn one mistake focus selfimprovement","4874"
"clinic start will make sure focus correct mistake become good healthcare professional","4875"
"become professional take lot hard work conscientious effort","4876"
"ive make mistake clinic reflect good professionalism","4877"
"always try good make mistake","4878"
"feel like always something learn room improvement","4879"
"will strive good work hard learn much can graduate will wellrounded student complete dental professional","4880"
"id like think ive make progress become professional","4881"
"ill let friend judge become professional","4882"
"studentdentist work become dental professional id say road get goal efficient selfaware knowledgeable dental professional hard","4883"
"definitely doable many dentist faculty doctor ive shadow epitome standard","4884"
"can focus immediate future strive behave way make decent professional","4885"
"ive certainly make progress compare landon month ago versus landon moment like say theres long way go","4886"
"couple month since ive clinic absolutely love","4887"
"moment tire","4888"
"moment help appreciate notion compassionate dentist even","4889"
"always try work hard aware action measure gauge patient may understand feel time","4890"
"always push tiredness aside focus provide good patient care can achieve","4891"
"patient thank compassionate towards","4892"
"gratitude make realize professional take hard work discipline","4893"
"focus time patient hard thing","4894"
"appreciate faculty always seem focus time","4895"
"next four year like become good person","4896"
"like learn skill tool can use help people restore something lose help people fix something break","4897"
"also like lie foundation become somebody great general dental practitioner","4898"
"2 goal build professional framework peer future colleague also faculty advisor patient","4899"
"also like achieve social status can become part social group share value principle","4900"
"last less like family proud child look example success","4901"
"professional family require superb selforganization good patientce","4902"
"like spare time spend kid husband parent","4903"
"hour day never enough","4904"
"definitely gain confidence action word","4905"
"attribute become parent two half year dental school","4906"
"slightly year leave journey nyucd","4907"
"seem like long year study hard work will come end know","4908"
"graduation near worry come go learn enough dental practitioner","4909"
"definitely room improvement","4910"
"order influence people health make positive change life assertive way treat patient","4911"
"patient come see young student dentist immediately face mistrust","4912"
"something cant change can work improve self presentation delivery treatment","4913"
"action speak loud word","4914"
"think become professional mean learn singular skill perfection","4915"
"2 year dental school change perception definition profession","4916"
"profession require lot interpersonal skill good","4917"
"already learn good scientist now need learn deliver exceptional care patient","4918"
"owe profession adapt invest work ethic","4919"
"wish say thing slow regain ability learn humble manner","4920"
"instead seem adapt brutal pace push finish line graduation","4921"
"often time rush complete treatment forget patient behind treatment","4922"
"make progress expedite pace","4923"
"certain can keep pace two three year","4924"
"like still make progress speed though may challenge","4925"
"professional mean carry unique skill still room perfection","4926"
"improve patient interaction skill good practical aspect dentistry","4927"
"confident choice spend little time double check time treat","4928"
"like learn skill tool method can use help restore people something precious vital lose break","4929"
"use learn ameliorate pain discomfort embarrassment disease","4930"
"like continue reinforce foundation start early genomic research can also introduce personalize therapy future clinic thereby increase potential successful treatment reduce wasteful expenditure prevent prolong suffer","4931"
"focus expand professional network new peer future colleague also faculty advisor patient will work","4932"
"believe right connection foster opportunity inside outside academia unite other share value principle create healthy happy productive planet","4933"
"like help everybody need good smile healthy mouth body also seek kind help medical psychological personal","4934"
"truly heart believe ninety percent student nyu college dentistry ethical come see patient impressive","4935"
"much pressure competition nyu end day dentist need ethical health care provider","4936"
"school mdr cee real world money honestly seem like people stress cees money","4937"
"good lesson remember just reward procedure mean can rush bad job","4938"
"like profession compensation dentistry base treatment give another human pretty much always information disagree dentist treatment","4939"
"hard situation complicate fact time dental student start people already either ethical interact other","4940"
"sure much can teach","4941"
"think will important understand dental theory good possess technical skill order good dentist can","4942"
"like able find time serve dental need community student nyu also practice dentist even though may mean need sacrifice time money","4943"
"think dentistry can greatly impact individual ’ s life like able help people may mean get treatment deserve","4944"
"like kind clear patient","4945"
"dentist shadow come school incredibly compassionate strive dentist like","4946"
"goal school still make time outside study","4947"
"like able maintain relationship able work still learn excellent dentist","4948"
"think past year dental school learn lot information will need dentist","4949"
"finally know drill tooth idea preparation restoration plastic tooth","4950"
"think lot work need do term see patient become comfortable drill someones mouth","4951"
"learn lot study class think will learn lot mean become professional class clinical experience","4952"
"moment feel become excellent student professionalism will follow time","4953"
"struggle overcome shy actually able get question medical history health provider need ask uncomfortable question patietns sometimes need hurt order make feel good","4954"
"always easy get good","4955"
"boyfriend come patient really hard","4956"
"dental phobic didnt really understand try give clean","4957"
"experience really hard hard see someone care feel bad even do painful procedure","4958"
"professionalism interest concept","4959"
"tell day one nyu know part dental profession must always conduct professional","4960"
"dentist anything bad shoot lion bad case road rage use know dirty needle reflect poorly us member dental community suffer one person action","4961"
"become student nyu instantly become part small community dentist","4962"
"important professional respect trust patient","4963"
"patient trust respect us will start take dental health hand oral health will decline","4964"
"also need professional dentist can proud profession part","4965"
"time one dentist make mistake hurt whole community","4966"
"didnt realize much true actually start work patient realize important public image can","4967"
"world connect take one mistake someone lose good will heshe spend hisher entire life work","4968"
"work patient really important present","4969"
"think make lot progress professional","4970"
"understand much dentistry now arrive dental school","4971"
"really learn time just need put nose work hard possibly can","4972"
"feel like dental school different","4973"
"lot course begin transition clinic","4974"
"crazy think time finally come will see patient actually function like dentist think ready transition","4975"
"master student different master dentist","4976"
"think now time will really learn know dentist","4977"
"say can really easy get discourage feel patient fall behind","4978"
"day leave clinic feel like awesome can anything","4979"
"day show think prepare situation become something never expect","4980"
"think get good handle unknown definitely know procedure definitely still toe","4981"
"finish 3 year nyu goal start change","4982"
"still lot pressure school meet certain requirement get certain numb point can hard stay track really important","4983"
"face last year nyu realize important try learn much can everyday","4984"
"every patient different every procedure little bite different","4985"
"school plenty people around hold hand desperate always someone can show right way","4986"
"know outside school go completely without help will need much independent","4987"
"upcoming month want focus get much knowledge dentistry possible can ready actually leave school first time since five year old","4988"
"common ethical dilemma arise clinic thing will fulfill requirement dental school good treatment patient","4989"
"feel always choose whats good patient dilemma arise","4990"
"patient always come first long work hard requirement will come","4991"
"cda patient center clinic feel represent ideal good","4992"
"learn become professional mean work hard always come prepare arrive clinic early take responsibility action","4993"
"sport figure idolize werent great luck product hard work determination","4994"
"success anything come without preparation work ethic","4995"
"professional learn become leader work hard","4996"
"feel make great stride development dental professional feel can","4997"
"initially scare make mistake treat patient become comfortable realize just thing worry much","4998"
"realize long come prepare work beforehand shouldnt worry problem happen","4999"
"nothing life guarantee can good prepare good react happen","5000"
"still lot learn stride make professional","5001"
"time nyu near end one year leave aim help many people can make stride skill clinician","5002"
"come learn dental school development dentist patient can","5003"
"want make patient comfortable inform dental issue","5004"
"aim become leader set example incoming class help progress professional senior","5005"
"will hard can demonstrate motivate intelligent care dental professional","5006"
"important knowledge principle ethic professionalism order successful dentist","5007"
"principle ethic goal profession dentist strive follow order give good care patient","5008"
"five fundamental principle ethic patient autonomy nonmaleficence beneficence justice veracity","5009"
"believe become professional require proficient competent many skill","5010"
"come experience patient care","5011"
"important good manual dexterity knowledge basic science health promotion disease prevention know diagnose treatment plan accurately","5012"
"past two year learn lot dental school","5013"
"anatomy physiology biochemistry have microbiology pathology have tough road first two year","5014"
"bench sim lab learn drill tooth include class iv prep crown prep bridge prep","5015"
"learn process fabricate complete removable partial denture arch","5016"
"rd year apply knowledge skill learn first two year patient care important competent dentist","5017"
"do restoration cleaning patient im progressively get use clinic","5018"
"do crown start work denture good","5019"
"do root canal therapy extraction oral surgery rotation treat child pediatric rotation watch implant surgery periodontics rotation","5020"
"goal throughout dental school develop skill need become successful dentist gain competence field","5021"
"want develop good skill manual dexterity interact patient great patient care","5022"
"want interact patient personal level become good dentist can","5023"
"experience far clinic enlighten","5024"
"learn dentistry last month first year","5025"
"learn every day dentistry become interest ever especially start apply skill learn patient care","5026"
"want become good dentist can start learn something new everyday","5027"
"ethical hold rule regulation nyucd expect student faculty plan continue next four year","5028"
"honesty patient foundation dental career","5029"
"provider show empathy towards patient","5030"
"provider put shoe patient understand position patient use prove patient good treatment plan individual need","5031"
"will never compromise moral value sort gain","5032"
"will always empathy towards patient always understand come present certain issue","5033"
"next four year plan gain skill necessary become competent trust honorable dentist","5034"
"hope gain proper technique communication skill effectively treat care patient","5035"
"hope build last relationship colleague faculty student","5036"
"plan gain understand great dental need community local global contribute need dental school practice post dental school work","5037"
"goal show empathy towards patient understand every one need good can meet need","5038"
"plan gain overall knowledge different area dentistry endodontics prosthodontics periodontics oral surgery","5039"
"next four year hope gain skill necessary depict professional peer patient","5040"
"plan gain insight faculty use example","5041"
"hope become professional dentist equip skill serve patient community","5042"
"will continue learn every new procedure expose improve skill become good dental professional can","5043"
"will put much effort necessary gain knowledge skill necessary successfully treat patient","5044"
"want become health professional respect necessary piece dental community","5045"
"plan solid knowledge different area dentistry properly treat patient","5046"
"next four year hope gain skill necessary depict professional peer patient","5047"
"plan gain insight faculty use example","5048"
"hope become professional dentist equip skill serve patient community","5049"
"hope treat patient utmost respect continue empathize understand individual patient need improve health","5050"
"will put much effort necessary gain knowledge skill necessary successfully treat patient","5051"
"want become health professional respect necessary piece dental community","5052"
"plan solid knowledge different area dentistry properly treat patient","5053"
"first year nyucd believe progress good professional","5054"
"learn nyu expect student professionalism must show towards colleague future patient learn class pediatrics able experience first patient","5055"
"begin clinic begin work patient believe slowly evolve health professional","5056"
"plan continue journey next year half nyu graduation","5057"
"look back year nyu proud immense progress make didactic clinical education","5058"
"learn treatment plan diagnose complex case present clinic diagnose periodontal disease endodontic issue prosthodontic concern much","5059"
"next four year plan gain skill necessary become competent trust honorable dentist","5060"
"hope gain proper technique communication skill effectively treat care patient","5061"
"hope build last relationship colleague faculty student","5062"
"plan gain understand great dental need community local global contribute need post dental school","5063"
"hope understand need patient good can provide plan help improve just oral health overall health","5064"
"plan absorb much knowledge possible can every different area dentistry","5065"
"plan gain overall knowledge different area dentistry endodontics prosthodontics periodontics oral surgery","5066"
"have year thus far fairly good","5067"
"get much good timemanagement find easy stay top didactic course work","5068"
"ive also enjoy course much last year","5069"
"now get dentalrelated topic find engage excite","5070"
"ive much enjoy lab work","5071"
"think can pretty critical work however slow lab often putting behind due date","5072"
"although im happy hand skill think benefit come night weekend practice","5073"
"im go make goal next semester","5074"
"become active extracurriculars think onset dental school","5075"
